Question Title,Question Slug,Question ID,Question Text,Topic Tagged text,Topic Tagged ID,Difficulty Level,Success Rate,total submission,total accepted,company tag,Likes,Dislikes,Hints,Similar Questions ID,Similar Questions Text
Maximum Number of Events That Can Be Attended II,maximum-number-of-events-that-can-be-attended-ii,1851,"You are given an array of events where events[i] = [startDayi, endDayi, valuei]. The ith event starts at startDayi and ends at endDayi, and if you attend this event, you will receive a value of valuei. You are also given an integer k which represents the maximum number of events you can attend. You can only attend one event at a time. If you choose to attend an event, you must attend the entire event. Note that the end day is inclusive: that is, you cannot attend two events where one of them starts and the other ends on the same day. Return the maximum sum of values that you can receive by attending events. ","Array,Binary Search,Dynamic Programming","VG9waWNUYWdOb2RlOjU=,VG9waWNUYWdOb2RlOjEx,VG9waWNUYWdOb2RlOjEz",Hard,54.8,25989,14235,,458,10,"Sort the events by its startTime. For every event, you can either choose it and consider the next event available, or you can ignore it. You can efficiently find the next event that is available using binary search.","1478,2118,2164","Maximum Number of Events That Can Be Attended,Maximum Earnings From Taxi,Two Best Non-Overlapping Events"
Check if Array Is Sorted and Rotated,check-if-array-is-sorted-and-rotated,1878,"Given an array nums, return true if the array was originally sorted in non-decreasing order, then rotated some number of positions (including zero). Otherwise, return false. There may be duplicates in the original array. Note: An array A rotated by x positions results in an array B of the same length such that A[i] == B[(i+x) % A.length], where % is the modulo operation. ",Array,VG9waWNUYWdOb2RlOjU=,Easy,47.8,70223,33539,,549,48,Brute force and check if it is possible for a sorted array to start from each position.,2243,Check if All A's Appears Before All B's
Maximum Score From Removing Stones,maximum-score-from-removing-stones,1879,"You are playing a solitaire game with three piles of stones of sizes a​​​​​​, b,​​​​​​ and c​​​​​​ respectively. Each turn you choose two different non-empty piles, take one stone from each, and add 1 point to your score. The game stops when there are fewer than two non-empty piles (meaning there are no more available moves). Given three integers a​​​​​, b,​​​​​ and c​​​​​, return the maximum score you can get. ","Math,Greedy,Heap (Priority Queue)","VG9waWNUYWdOb2RlOjg=,VG9waWNUYWdOb2RlOjE3,VG9waWNUYWdOb2RlOjYxMDUw",Medium,65.2,32426,21143,,485,34,It's optimal to always remove one stone from the biggest 2 piles Note that the limits are small enough for simulation,,
Largest Merge Of Two Strings,largest-merge-of-two-strings,1880,"You are given two strings word1 and word2. You want to construct a string merge in the following way: while either word1 or word2 are non-empty, choose one of the following options: Return the lexicographically largest merge you can construct. A string a is lexicographically larger than a string b (of the same length) if in the first position where a and b differ, a has a character strictly larger than the corresponding character in b. For example, ""abcd"" is lexicographically larger than ""abcc"" because the first position they differ is at the fourth character, and d is greater than c. ","Two Pointers,String,Greedy","VG9waWNUYWdOb2RlOjk=,VG9waWNUYWdOb2RlOjEw,VG9waWNUYWdOb2RlOjE3",Medium,44.0,32039,14091,,340,52,"Build the result character by character. At each step, you choose a character from one of the two strings. If the next character of the first string is larger than that of the second string, or vice versa, it's optimal to use the larger one. If both are equal, think of a criteria that lets you decide which string to consume the next character from. You should choose the next character from the larger string.",,
Closest Subsequence Sum,closest-subsequence-sum,1881,"You are given an integer array nums and an integer goal. You want to choose a subsequence of nums such that the sum of its elements is the closest possible to goal. That is, if the sum of the subsequence's elements is sum, then you want to minimize the absolute difference abs(sum - goal). Return the minimum possible value of abs(sum - goal). Note that a subsequence of an array is an array formed by removing some elements (possibly all or none) of the original array. ","Array,Two Pointers,Dynamic Programming,Bit Manipulation,Bitmask","VG9waWNUYWdOb2RlOjU=,VG9waWNUYWdOb2RlOjk=,VG9waWNUYWdOb2RlOjEz,VG9waWNUYWdOb2RlOjE5,VG9waWNUYWdOb2RlOjYxMDc4",Hard,36.3,23471,8525,,436,58,"The naive solution is to check all possible subsequences. This works in O(2^n). Divide the array into two parts of nearly is equal size. Consider all subsets of one part and make a list of all possible subset sums and sort this list. Consider all subsets of the other part, and for each one, let its sum = x, do binary search to get the nearest possible value to goal - x in the first part.","2108,2162","Minimize the Difference Between Target and Chosen Elements,Partition Array Into Two Arrays to Minimize Sum Difference"
Design Most Recently Used Queue,design-most-recently-used-queue,1903,,"Array,Hash Table,Stack,Design,Binary Indexed Tree,Ordered Set","VG9waWNUYWdOb2RlOjU=,VG9waWNUYWdOb2RlOjY=,VG9waWNUYWdOb2RlOjE1,VG9waWNUYWdOb2RlOjI1,VG9waWNUYWdOb2RlOjI4,VG9waWNUYWdOb2RlOjYxMDcw",Medium,79.0,7054,5575,,153,12,"You can store the data in an array and apply each fetch by moving the ith element to the end of the array (i.e, O(n) per operation). A better way is to use the square root decomposition technique. You can build chunks of size sqrt(n). For each fetch operation, You can search for the chunk which has the ith element and update it (i.e., O(sqrt(n)) per operation), and move this element to an empty chunk at the end.",146,LRU Cache
Recyclable and Low Fat Products,recyclable-and-low-fat-products,1908,Table: Products  Write an SQL query to find the ids of products that are both low fat and recyclable. Return the result table in any order. The query result format is in the following example. ,Database,VG9waWNUYWdOb2RlOjYxMDQz,Easy,95.5,41265,39399,,171,51,,,
Minimum Changes To Make Alternating Binary String,minimum-changes-to-make-alternating-binary-string,1884,"You are given a string s consisting only of the characters '0' and '1'. In one operation, you can change any '0' to '1' or vice versa. The string is called alternating if no two adjacent characters are equal. For example, the string ""010"" is alternating, while the string ""0100"" is not. Return the minimum number of operations needed to make s alternating. ",String,VG9waWNUYWdOb2RlOjEw,Easy,59.1,45138,26699,,397,14,"Think about how the final string will look like. It will either start with a '0' and be like '010101010..' or with a '1' and be like '10101010..' Try both ways, and check for each way, the number of changes needed to reach it from the given string. The answer is the minimum of both ways.",,
Count Number of Homogenous Substrings,count-number-of-homogenous-substrings,1885,"Given a string s, return the number of homogenous substrings of s. Since the answer may be too large, return it modulo 109 + 7. A string is homogenous if all the characters of the string are the same. A substring is a contiguous sequence of characters within a string. ","Math,String","VG9waWNUYWdOb2RlOjg=,VG9waWNUYWdOb2RlOjEw",Medium,46.4,38800,18005,,376,38,"A string of only 'a's of length k contains k choose 2 homogenous substrings. Split the string into substrings where each substring contains only one letter, and apply the formula on each substring's length.","1542,1636,2227","Consecutive Characters,Number of Substrings With Only 1s,Sum of Subarray Ranges"
Minimum Limit of Balls in a Bag,minimum-limit-of-balls-in-a-bag,1886,You are given an integer array nums where the ith bag contains nums[i] balls. You are also given an integer maxOperations. You can perform the following operation at most maxOperations times: Your penalty is the maximum number of balls in a bag. You want to minimize your penalty after the operations. Return the minimum possible penalty after performing the operations. ,"Array,Binary Search","VG9waWNUYWdOb2RlOjU=,VG9waWNUYWdOb2RlOjEx",Medium,57.3,28972,16602,,965,32,Let's change the question if we know the maximum size of a bag what is the minimum number of bags you can make note that as the maximum size increases the minimum number of bags decreases so we can binary search the maximum size,"1335,2188","Maximum Candies Allocated to K Children,Minimized Maximum of Products Distributed to Any Store"
Minimum Degree of a Connected Trio in a Graph,minimum-degree-of-a-connected-trio-in-a-graph,1887,"You are given an undirected graph. You are given an integer n which is the number of nodes in the graph and an array edges, where each edges[i] = [ui, vi] indicates that there is an undirected edge between ui and vi. A connected trio is a set of three nodes where there is an edge between every pair of them. The degree of a connected trio is the number of edges where one endpoint is in the trio, and the other is not. Return the minimum degree of a connected trio in the graph, or -1 if the graph has no connected trios. ",Graph,VG9waWNUYWdOb2RlOjI0,Hard,41.4,36422,15094,,189,208,"Consider a trio with nodes u, v, and w. The degree of the trio is just degree(u) + degree(v) + degree(w) - 6. The -6 comes from subtracting the edges u-v, u-w, and v-w, which are counted twice each in the vertex degree calculation. To get the trios (u,v,w), you can iterate on u, then iterate on each w,v such that w and v are neighbors of u and are neighbors of each other.",,
Buildings With an Ocean View,buildings-with-an-ocean-view,1909,,"Array,Stack,Monotonic Stack","VG9waWNUYWdOb2RlOjU=,VG9waWNUYWdOb2RlOjE1,VG9waWNUYWdOb2RlOjYxMDU0",Medium,80.0,127347,101846,,746,100,You can traverse the buildings from the nearest to the ocean to the furthest. Keep with you the maximum to the right while traversing to determine if you can see the ocean or not.,1305,Number of Visible People in a Queue
Longest Nice Substring,longest-nice-substring,1873,"A string s is nice if, for every letter of the alphabet that s contains, it appears both in uppercase and lowercase. For example, ""abABB"" is nice because 'A' and 'a' appear, and 'B' and 'b' appear. However, ""abA"" is not because 'b' appears, but 'B' does not. Given a string s, return the longest substring of s that is nice. If there are multiple, return the substring of the earliest occurrence. If there are none, return an empty string. ","Hash Table,String,Bit Manipulation,Sliding Window","VG9waWNUYWdOb2RlOjY=,VG9waWNUYWdOb2RlOjEw,VG9waWNUYWdOb2RlOjE5,VG9waWNUYWdOb2RlOjU1ODIx",Easy,61.9,36825,22808,,561,432,Brute force and check each substring to see if it is nice.,,
Form Array by Concatenating Subarrays of Another Array,form-array-by-concatenating-subarrays-of-another-array,1874,"You are given a 2D integer array groups of length n. You are also given an integer array nums. You are asked if you can choose n disjoint subarrays from the array nums such that the ith subarray is equal to groups[i] (0-indexed), and if i > 0, the (i-1)th subarray appears before the ith subarray in nums (i.e. the subarrays must be in the same order as groups). Return true if you can do this task, and false otherwise. Note that the subarrays are disjoint if and only if there is no index k such that nums[k] belongs to more than one subarray. A subarray is a contiguous sequence of elements within an array. ","Array,Greedy,String Matching","VG9waWNUYWdOb2RlOjU=,VG9waWNUYWdOb2RlOjE3,VG9waWNUYWdOb2RlOjYxMDUy",Medium,53.0,19359,10259,,202,21,"When we use a subarray, the room for the next subarrays will be the suffix after the used subarray. If we can match a group with multiple subarrays, we should choose the first one, as this will just leave the largest room for the next subarrays.",,
Map of Highest Peak,map-of-highest-peak,1876,"You are given an integer matrix isWater of size m x n that represents a map of land and water cells. You must assign each cell a height in a way that follows these rules: Find an assignment of heights such that the maximum height in the matrix is maximized. Return an integer matrix height of size m x n where height[i][j] is cell (i, j)'s height. If there are multiple solutions, return any of them. ","Array,Breadth-First Search,Matrix","VG9waWNUYWdOb2RlOjU=,VG9waWNUYWdOb2RlOjIy,VG9waWNUYWdOb2RlOjYxMDUz",Medium,59.8,27052,16182,,493,31,Set each water cell to be 0. The height of each cell is limited by its closest water cell. Perform a multi-source BFS with all the water cells as sources.,,
Tree of Coprimes,tree-of-coprimes,1875,"There is a tree (i.e., a connected, undirected graph that has no cycles) consisting of n nodes numbered from 0 to n - 1 and exactly n - 1 edges. Each node has a value associated with it, and the root of the tree is node 0. To represent this tree, you are given an integer array nums and a 2D array edges. Each nums[i] represents the ith node's value, and each edges[j] = [uj, vj] represents an edge between nodes uj and vj in the tree. Two values x and y are coprime if gcd(x, y) == 1 where gcd(x, y) is the greatest common divisor of x and y. An ancestor of a node i is any other node on the shortest path from node i to the root. A node is not considered an ancestor of itself. Return an array ans of size n, where ans[i] is the closest ancestor to node i such that nums[i] and nums[ans[i]] are coprime, or -1 if there is no such ancestor. ","Math,Tree,Depth-First Search,Breadth-First Search","VG9waWNUYWdOb2RlOjg=,VG9waWNUYWdOb2RlOjIw,VG9waWNUYWdOb2RlOjIx,VG9waWNUYWdOb2RlOjIy",Hard,38.3,14330,5486,,224,17,"Note that for a node, it's not optimal to consider two nodes with the same value. Note that the values are small enough for you to iterate over them instead of iterating over the parent nodes.",,
Find the Subtasks That Did Not Execute,find-the-subtasks-that-did-not-execute,1914,,Database,VG9waWNUYWdOb2RlOjYxMDQz,Hard,84.0,5399,4535,,83,8,,,
Merge Strings Alternately,merge-strings-alternately,1894,"You are given two strings word1 and word2. Merge the strings by adding letters in alternating order, starting with word1. If a string is longer than the other, append the additional letters onto the end of the merged string. Return the merged string. ","Two Pointers,String","VG9waWNUYWdOb2RlOjk=,VG9waWNUYWdOb2RlOjEw",Easy,75.5,71706,54156,,544,8,"Use two pointers, one pointer for each string. Alternately choose the character from each pointer, and move the pointer upwards.",281,Zigzag Iterator
Minimum Number of Operations to Move All Balls to Each Box,minimum-number-of-operations-to-move-all-balls-to-each-box,1895,"You have n boxes. You are given a binary string boxes of length n, where boxes[i] is '0' if the ith box is empty, and '1' if it contains one ball. In one operation, you can move one ball from a box to an adjacent box. Box i is adjacent to box j if abs(i - j) == 1. Note that after doing so, there may be more than one ball in some boxes. Return an array answer of size n, where answer[i] is the minimum number of operations needed to move all the balls to the ith box. Each answer[i] is calculated considering the initial state of the boxes. ","Array,String","VG9waWNUYWdOb2RlOjU=,VG9waWNUYWdOb2RlOjEw",Medium,85.7,83851,71875,,1341,50,"If you want to move a ball from box i to box j, you'll need abs(i-j) moves. To move all balls to some box, you can move them one by one. For each box i, iterate on each ball in a box j, and add abs(i-j) to answers[i].",1329,Minimum Cost to Move Chips to The Same Position
Maximum Score from Performing Multiplication Operations,maximum-score-from-performing-multiplication-operations,1896,"You are given two integer arrays nums and multipliers of size n and m respectively, where n >= m. The arrays are 1-indexed. You begin with a score of 0. You want to perform exactly m operations. On the ith operation (1-indexed), you will: Return the maximum score after performing m operations. ","Array,Dynamic Programming","VG9waWNUYWdOb2RlOjU=,VG9waWNUYWdOb2RlOjEz",Medium,35.6,86671,30813,,716,168,"At first glance, the solution seems to be greedy, but if you try to greedily take the largest value from the beginning or the end, this will not be optimal. You should try all scenarios but this will be costy. Memoizing the pre-visited states while trying all the possible scenarios will reduce the complexity, and hence dp is a perfect choice here.","1538,1808","Maximum Points You Can Obtain from Cards,Stone Game VII"
Maximize Palindrome Length From Subsequences,maximize-palindrome-length-from-subsequences,1897,"You are given two strings, word1 and word2. You want to construct a string in the following manner: Return the length of the longest palindrome that can be constructed in the described manner. If no palindromes can be constructed, return 0. A subsequence of a string s is a string that can be made by deleting some (possibly none) characters from s without changing the order of the remaining characters. A palindrome is a string that reads the same forward as well as backward. ","String,Dynamic Programming","VG9waWNUYWdOb2RlOjEw,VG9waWNUYWdOb2RlOjEz",Hard,34.7,21058,7302,,346,7,"Let's ignore the non-empty subsequence constraint. We can concatenate the two strings and find the largest palindromic subsequence with dynamic programming. Iterate through every pair of characters word1[i] and word2[j], and see if some palindrome begins with word1[i] and ends with word2[j]. This ensures that the subsequences are non-empty.",516,Longest Palindromic Subsequence
Sort Features by Popularity,sort-features-by-popularity,1919,,"Array,Hash Table,String,Sorting","VG9waWNUYWdOb2RlOjU=,VG9waWNUYWdOb2RlOjY=,VG9waWNUYWdOb2RlOjEw,VG9waWNUYWdOb2RlOjYxMDQ5",Medium,65.7,5572,3660,,47,37,Use a hash map to count the frequency of each word of each string. Use the map for sorting the features.,"347,692","Top K Frequent Elements,Top K Frequent Words"
Count Items Matching a Rule,count-items-matching-a-rule,1899,"You are given an array items, where each items[i] = [typei, colori, namei] describes the type, color, and name of the ith item. You are also given a rule represented by two strings, ruleKey and ruleValue. The ith item is said to match the rule if one of the following is true: Return the number of items that match the given rule. ","Array,String","VG9waWNUYWdOb2RlOjU=,VG9waWNUYWdOb2RlOjEw",Easy,84.4,115830,97763,,831,104,"Iterate on each item, and check if each one matches the rule according to the statement.",,
Closest Dessert Cost,closest-dessert-cost,1900,"You would like to make dessert and are preparing to buy the ingredients. You have n ice cream base flavors and m types of toppings to choose from. You must follow these rules when making your dessert: You are given three inputs: You want to make a dessert with a total cost as close to target as possible. Return the closest possible cost of the dessert to target. If there are multiple, return the lower one. ","Array,Dynamic Programming,Backtracking","VG9waWNUYWdOb2RlOjU=,VG9waWNUYWdOb2RlOjEz,VG9waWNUYWdOb2RlOjE0",Medium,45.9,33299,15275,,409,43,"As the constraints are not large, you can brute force and enumerate all the possibilities.",,
Equal Sum Arrays With Minimum Number of Operations,equal-sum-arrays-with-minimum-number-of-operations,1901,"You are given two arrays of integers nums1 and nums2, possibly of different lengths. The values in the arrays are between 1 and 6, inclusive. In one operation, you can change any integer's value in any of the arrays to any value between 1 and 6, inclusive. Return the minimum number of operations required to make the sum of values in nums1 equal to the sum of values in nums2. Return -1​​​​​ if it is not possible to make the sum of the two arrays equal. ","Array,Hash Table,Greedy,Counting","VG9waWNUYWdOb2RlOjU=,VG9waWNUYWdOb2RlOjY=,VG9waWNUYWdOb2RlOjE3,VG9waWNUYWdOb2RlOjYxMDYy",Medium,51.4,28446,14621,,494,16,Let's note that we want to either decrease the sum of the array with a larger sum or increase the array's sum with the smaller sum. You can maintain the largest increase or decrease you can make in a binary search tree and each time get the maximum one.,1263,Number of Dice Rolls With Target Sum
Car Fleet II,car-fleet-ii,1902,"There are n cars traveling at different speeds in the same direction along a one-lane road. You are given an array cars of length n, where cars[i] = [positioni, speedi] represents: For simplicity, cars can be considered as points moving along the number line. Two cars collide when they occupy the same position. Once a car collides with another car, they unite and form a single car fleet. The cars in the formed fleet will have the same position and the same speed, which is the initial speed of the slowest car in the fleet. Return an array answer, where answer[i] is the time, in seconds, at which the ith car collides with the next car, or -1 if the car does not collide with the next car. Answers within 10-5 of the actual answers are accepted. ","Array,Math,Stack,Heap (Priority Queue),Monotonic Stack","VG9waWNUYWdOb2RlOjU=,VG9waWNUYWdOb2RlOjg=,VG9waWNUYWdOb2RlOjE1,VG9waWNUYWdOb2RlOjYxMDUw,VG9waWNUYWdOb2RlOjYxMDU0",Hard,52.6,34432,18117,,572,15,"We can simply ignore the merging of any car fleet, simply assume they cross each other. Now the aim is to find the first car to the right, which intersects with the current car before any other. Assume we have already considered all cars to the right already, now the current car is to be considered. Let’s ignore all cars with speeds higher than the current car since the current car cannot intersect with those ones. Now, all cars to the right having speed strictly less than current car are to be considered. Now, for two cars c1 and c2 with positions p1 and p2 (p1 < p2) and speed s1 and s2 (s1 > s2), if c1 and c2 intersect before the current car and c2, then c1 can never be the first car of intersection for any car to the left of current car including current car. So we can remove that car from our consideration. We can see that we can maintain candidate cars in this way using a stack, removing cars with speed greater than or equal to current car, and then removing cars which can never be first point of intersection. The first car after this process (if any) would be first point of intersection.","883,2317","Car Fleet,Count Collisions on a Road"
Product's Price for Each Store,products-price-for-each-store,1926,,Database,VG9waWNUYWdOb2RlOjYxMDQz,Easy,85.8,13006,11164,,80,7,,1948,Rearrange Products Table
Shortest Path in a Hidden Grid,shortest-path-in-a-hidden-grid,1931,,"Depth-First Search,Breadth-First Search,Graph,Interactive","VG9waWNUYWdOb2RlOjIx,VG9waWNUYWdOb2RlOjIy,VG9waWNUYWdOb2RlOjI0,VG9waWNUYWdOb2RlOjYxMDU5",Medium,41.3,9307,3846,,112,45,"The grid is at a maximum 500 x 500, so it is clever to assume that the robot's initial cell is grid[501][501] Run a DFS from the robot's position to make sure that you can reach the target, otherwise you should return -1. Now that you are sure you can reach the target, run BFS to find the shortest path.","865,1959","Robot Room Cleaner,Minimum Path Cost in a Hidden Grid"
Find Nearest Point That Has the Same X or Y Coordinate,find-nearest-point-that-has-the-same-x-or-y-coordinate,1888,"You are given two integers, x and y, which represent your current location on a Cartesian grid: (x, y). You are also given an array points where each points[i] = [ai, bi] represents that a point exists at (ai, bi). A point is valid if it shares the same x-coordinate or the same y-coordinate as your location. Return the index (0-indexed) of the valid point with the smallest Manhattan distance from your current location. If there are multiple, return the valid point with the smallest index. If there are no valid points, return -1. The Manhattan distance between two points (x1, y1) and (x2, y2) is abs(x1 - x2) + abs(y1 - y2). ",Array,VG9waWNUYWdOb2RlOjU=,Easy,68.2,65007,44355,,378,69,"Iterate through each point, and keep track of the current point with the smallest Manhattan distance from your current location.",1014,K Closest Points to Origin
Check if Number is a Sum of Powers of Three,check-if-number-is-a-sum-of-powers-of-three,1889,"Given an integer n, return true if it is possible to represent n as the sum of distinct powers of three. Otherwise, return false. An integer y is a power of three if there exists an integer x such that y == 3x. ",Math,VG9waWNUYWdOb2RlOjg=,Medium,64.7,32597,21101,,505,18,Let's note that the maximum power of 3 you'll use in your soln is 3^16 The number can not be represented as a sum of powers of 3 if it's ternary presentation has a 2 in it,326,Power of Three
Sum of Beauty of All Substrings,sum-of-beauty-of-all-substrings,1890,"The beauty of a string is the difference in frequencies between the most frequent and least frequent characters. Given a string s, return the sum of beauty of all of its substrings. ","Hash Table,String,Counting","VG9waWNUYWdOb2RlOjY=,VG9waWNUYWdOb2RlOjEw,VG9waWNUYWdOb2RlOjYxMDYy",Medium,59.9,21629,12952,,306,83,Maintain a prefix sum for the frequencies of characters. You can iterate over all substring then iterate over the alphabet and find which character appears most and which appears least using the prefix sum array,2225,Substrings That Begin and End With the Same Letter
