Question Title,Question Slug,Question ID,Question Text,Topic Tagged text,Topic Tagged ID,Difficulty Level,Success Rate,total submission,total accepted,company tag,Likes,Dislikes,Hints,Similar Questions ID,Similar Questions Text
Minimum Number of K Consecutive Bit Flips,minimum-number-of-k-consecutive-bit-flips,1037,"You are given a binary array nums and an integer k. A k-bit flip is choosing a subarray of length k from nums and simultaneously changing every 0 in the subarray to 1, and every 1 in the subarray to 0. Return the minimum number of k-bit flips required so that there is no 0 in the array. If it is not possible, return -1. A subarray is a contiguous part of an array. ","Array,Bit Manipulation,Sliding Window,Prefix Sum","VG9waWNUYWdOb2RlOjU=,VG9waWNUYWdOb2RlOjE5,VG9waWNUYWdOb2RlOjU1ODIx,VG9waWNUYWdOb2RlOjYxMDY4",Hard,50.7,49867,25291,,792,49,,"319,2286","Bulb Switcher,Minimum Time to Remove All Cars Containing Illegal Goods"
Number of Squareful Arrays,number-of-squareful-arrays,1038,"An array is squareful if the sum of every pair of adjacent elements is a perfect square. Given an integer array nums, return the number of permutations of nums that are squareful. Two permutations perm1 and perm2 are different if there is some index i such that perm1[i] != perm2[i]. ","Array,Math,Dynamic Programming,Backtracking,Bit Manipulation,Bitmask","VG9waWNUYWdOb2RlOjU=,VG9waWNUYWdOb2RlOjg=,VG9waWNUYWdOb2RlOjEz,VG9waWNUYWdOb2RlOjE0,VG9waWNUYWdOb2RlOjE5,VG9waWNUYWdOb2RlOjYxMDc4",Hard,49.1,51178,25134,,657,27,,47,Permutations II
Find the Town Judge,find-the-town-judge,1039,"In a town, there are n people labeled from 1 to n. There is a rumor that one of these people is secretly the town judge. If the town judge exists, then: You are given an array trust where trust[i] = [ai, bi] representing that the person labeled ai trusts the person labeled bi. Return the label of the town judge if the town judge exists and can be identified, or return -1 otherwise. ","Array,Hash Table,Graph","VG9waWNUYWdOb2RlOjU=,VG9waWNUYWdOb2RlOjY=,VG9waWNUYWdOb2RlOjI0",Easy,49.8,542049,270102,,3301,253,,277,Find the Celebrity
Maximum Binary Tree II,maximum-binary-tree-ii,1040,"A maximum tree is a tree where every node has a value greater than any other value in its subtree. You are given the root of a maximum binary tree and an integer val. Just as in the previous problem, the given tree was constructed from a list a (root = Construct(a)) recursively with the following Construct(a) routine: Note that we were not given a directly, only a root node root = Construct(a). Suppose b is a copy of a with the value val appended to it. It is guaranteed that b has unique values. Return Construct(b). ","Tree,Binary Tree","VG9waWNUYWdOb2RlOjIw,VG9waWNUYWdOb2RlOjYxMDU3",Medium,65.5,40073,26266,,354,644,,654,Maximum Binary Tree
Available Captures for Rook,available-captures-for-rook,1041,"On an 8 x 8 chessboard, there is exactly one white rook 'R' and some number of white bishops 'B', black pawns 'p', and empty squares '.'. When the rook moves, it chooses one of four cardinal directions (north, east, south, or west), then moves in that direction until it chooses to stop, reaches the edge of the board, captures a black pawn, or is blocked by a white bishop. A rook is considered attacking a pawn if the rook can capture the pawn on the rook's turn. The number of available captures for the white rook is the number of pawns that the rook is attacking. Return the number of available captures for the white rook. ","Array,Matrix,Simulation","VG9waWNUYWdOb2RlOjU=,VG9waWNUYWdOb2RlOjYxMDUz,VG9waWNUYWdOb2RlOjYxMDU1",Easy,67.5,73332,49531,,443,560,,,
Minimum Cost to Merge Stones,minimum-cost-to-merge-stones,1042,"There are n piles of stones arranged in a row. The ith pile has stones[i] stones. A move consists of merging exactly k consecutive piles into one pile, and the cost of this move is equal to the total number of stones in these k piles. Return the minimum cost to merge all piles of stones into one pile. If it is impossible, return -1. ","Array,Dynamic Programming","VG9waWNUYWdOb2RlOjU=,VG9waWNUYWdOb2RlOjEz",Hard,42.0,65248,27381,,1524,79,,"312,1126","Burst Balloons,Minimum Cost to Connect Sticks"
Grid Illumination,grid-illumination,1043,"There is a 2D grid of size n x n where each cell of this grid has a lamp that is initially turned off. You are given a 2D array of lamp positions lamps, where lamps[i] = [rowi, coli] indicates that the lamp at grid[rowi][coli] is turned on. Even if the same lamp is listed more than once, it is turned on. When a lamp is turned on, it illuminates its cell and all other cells in the same row, column, or diagonal. You are also given another 2D array queries, where queries[j] = [rowj, colj]. For the jth query, determine whether grid[rowj][colj] is illuminated or not. After answering the jth query, turn off the lamp at grid[rowj][colj] and its 8 adjacent lamps if they exist. A lamp is adjacent if its cell shares either a side or corner with grid[rowj][colj]. Return an array of integers ans, where ans[j] should be 1 if the cell in the jth query was illuminated, or 0 if the lamp was not. ","Array,Hash Table","VG9waWNUYWdOb2RlOjU=,VG9waWNUYWdOb2RlOjY=",Hard,36.2,41358,14957,,390,104,,51,N-Queens
Find Common Characters,find-common-characters,1044,"Given a string array words, return an array of all characters that show up in all strings within the words (including duplicates). You may return the answer in any order. ","Array,Hash Table,String","VG9waWNUYWdOb2RlOjU=,VG9waWNUYWdOb2RlOjY=,VG9waWNUYWdOb2RlOjEw",Easy,68.4,207326,141846,,2273,184,,350,Intersection of Two Arrays II
Check If Word Is Valid After Substitutions,check-if-word-is-valid-after-substitutions,1045,"Given a string s, determine if it is valid. A string s is valid if, starting with an empty string t = """", you can transform t into s after performing the following operation any number of times: Return true if s is a valid string, otherwise, return false. ","String,Stack","VG9waWNUYWdOb2RlOjEw,VG9waWNUYWdOb2RlOjE1",Medium,57.9,70456,40769,,586,437,,20,Valid Parentheses
Max Consecutive Ones III,max-consecutive-ones-iii,1046,"Given a binary array nums and an integer k, return the maximum number of consecutive 1's in the array if you can flip at most k 0's. ","Array,Binary Search,Sliding Window,Prefix Sum","VG9waWNUYWdOb2RlOjU=,VG9waWNUYWdOb2RlOjEx,VG9waWNUYWdOb2RlOjU1ODIx,VG9waWNUYWdOb2RlOjYxMDY4",Medium,62.9,320003,201213,,4230,55,"One thing's for sure, we will only flip a zero if it extends an existing window of 1s. Otherwise, there's no point in doing it, right? Think Sliding Window! Since we know this problem can be solved using the sliding window construct, we might as well focus in that direction for hints. Basically, in a given window, we can never have > K zeros, right? We don't have a fixed size window in this case. The window size can grow and shrink depending upon the number of zeros we have (we don't actually have to flip the zeros here!). The way to shrink or expand a window would be based on the number of zeros that can still be flipped and so on.","340,424,485,487,2134","Longest Substring with At Most K Distinct Characters,Longest Repeating Character Replacement,Max Consecutive Ones,Max Consecutive Ones II,Maximize the Confusion of an Exam"
Maximize Sum Of Array After K Negations,maximize-sum-of-array-after-k-negations,1047,"Given an integer array nums and an integer k, modify the array in the following way: You should apply this process exactly k times. You may choose the same index i multiple times. Return the largest possible sum of the array after modifying it in this way. ","Array,Greedy,Sorting","VG9waWNUYWdOb2RlOjU=,VG9waWNUYWdOb2RlOjE3,VG9waWNUYWdOb2RlOjYxMDQ5",Easy,51.4,103684,53334,,954,79,,2204,Find Subsequence of Length K With the Largest Sum
Clumsy Factorial,clumsy-factorial,1048,"The factorial of a positive integer n is the product of all positive integers less than or equal to n. We make a clumsy factorial using the integers in decreasing order by swapping out the multiply operations for a fixed rotation of operations with multiply '*', divide '/', add '+', and subtract '-' in this order. However, these operations are still applied using the usual order of operations of arithmetic. We do all multiplication and division steps before any addition or subtraction steps, and multiplication and division steps are processed left to right. Additionally, the division that we use is floor division such that 10 * 9 / 8 = 90 / 8 = 11. Given an integer n, return the clumsy factorial of n. ","Math,Stack,Simulation","VG9waWNUYWdOb2RlOjg=,VG9waWNUYWdOb2RlOjE1,VG9waWNUYWdOb2RlOjYxMDU1",Medium,54.7,36299,19854,,186,228,,,
Minimum Domino Rotations For Equal Row,minimum-domino-rotations-for-equal-row,1049,"In a row of dominoes, tops[i] and bottoms[i] represent the top and bottom halves of the ith domino. (A domino is a tile with two numbers from 1 to 6 - one on each half of the tile.) We may rotate the ith domino, so that tops[i] and bottoms[i] swap values. Return the minimum number of rotations so that all the values in tops are the same, or all the values in bottoms are the same. If it cannot be done, return -1. ","Array,Greedy","VG9waWNUYWdOb2RlOjU=,VG9waWNUYWdOb2RlOjE3",Medium,52.6,337683,177735,,2423,239,,,
Construct Binary Search Tree from Preorder Traversal,construct-binary-search-tree-from-preorder-traversal,1050,"Given an array of integers preorder, which represents the preorder traversal of a BST (i.e., binary search tree), construct the tree and return its root. It is guaranteed that there is always possible to find a binary search tree with the given requirements for the given test cases. A binary search tree is a binary tree where for every node, any descendant of Node.left has a value strictly less than Node.val, and any descendant of Node.right has a value strictly greater than Node.val. A preorder traversal of a binary tree displays the value of the node first, then traverses Node.left, then traverses Node.right. ","Array,Stack,Tree,Binary Search Tree,Monotonic Stack,Binary Tree","VG9waWNUYWdOb2RlOjU=,VG9waWNUYWdOb2RlOjE1,VG9waWNUYWdOb2RlOjIw,VG9waWNUYWdOb2RlOjMw,VG9waWNUYWdOb2RlOjYxMDU0,VG9waWNUYWdOb2RlOjYxMDU3",Medium,80.2,287043,230198,,3543,60,,,
Complement of Base 10 Integer,complement-of-base-10-integer,1054,"The complement of an integer is the integer you get when you flip all the 0's to 1's and all the 1's to 0's in its binary representation. Given an integer n, return its complement. ",Bit Manipulation,VG9waWNUYWdOb2RlOjE5,Easy,62.3,200901,125125,,1314,70,"A binary number plus its complement will equal 111....111 in binary.  Also, N = 0 is a corner case.",,
Pairs of Songs With Total Durations Divisible by 60,pairs-of-songs-with-total-durations-divisible-by-60,1055,"You are given a list of songs where the ith song has a duration of time[i] seconds. Return the number of pairs of songs for which their total duration in seconds is divisible by 60. Formally, we want the number of indices i, j such that i < j with (time[i] + time[j]) % 60 == 0. ","Array,Hash Table,Counting","VG9waWNUYWdOb2RlOjU=,VG9waWNUYWdOb2RlOjY=,VG9waWNUYWdOb2RlOjYxMDYy",Medium,53.7,352306,189080,,3064,118,"We only need to consider each song length modulo 60. We can count the number of songs with (length % 60) equal to r, and store that in an array of size 60.",,
Capacity To Ship Packages Within D Days,capacity-to-ship-packages-within-d-days,1056,"A conveyor belt has packages that must be shipped from one port to another within days days. The ith package on the conveyor belt has a weight of weights[i]. Each day, we load the ship with packages on the conveyor belt (in the order given by weights). We may not load more weight than the maximum weight capacity of the ship. Return the least weight capacity of the ship that will result in all the packages on the conveyor belt being shipped within days days. ","Array,Binary Search,Greedy","VG9waWNUYWdOb2RlOjU=,VG9waWNUYWdOb2RlOjEx,VG9waWNUYWdOb2RlOjE3",Medium,63.5,225076,142938,,4119,94,Binary search on the answer.  We need a function possible(capacity) which returns true if and only if we can do the task in D days.,"410,1192,2045,2188","Split Array Largest Sum,Divide Chocolate,Cutting Ribbons,Minimized Maximum of Products Distributed to Any Store"
Numbers With Repeated Digits,numbers-with-repeated-digits,1057,"Given an integer n, return the number of positive integers in the range [1, n] that have at least one repeated digit. ","Math,Dynamic Programming","VG9waWNUYWdOb2RlOjg=,VG9waWNUYWdOb2RlOjEz",Hard,38.5,23326,8983,,393,62,How many numbers with no duplicate digits?  How many numbers with K digits and no duplicates? How many numbers with same length as N?  How many numbers with same prefix as N?,,
Partition Array Into Three Parts With Equal Sum,partition-array-into-three-parts-with-equal-sum,1062,"Given an array of integers arr, return true if we can partition the array into three non-empty parts with equal sums. Formally, we can partition the array if we can find indexes i + 1 < j with (arr[0] + arr[1] + ... + arr[i] == arr[i + 1] + arr[i + 2] + ... + arr[j - 1] == arr[j] + arr[j + 1] + ... + arr[arr.length - 1]) ","Array,Greedy","VG9waWNUYWdOb2RlOjU=,VG9waWNUYWdOb2RlOjE3",Easy,44.5,141004,62772,,1093,117,"If we have three parts with the same sum, what is the sum of each?
If you can find the first part, can you find the second part?",2102,Find the Middle Index in Array
Best Sightseeing Pair,best-sightseeing-pair,1063,"You are given an integer array values where values[i] represents the value of the ith sightseeing spot. Two sightseeing spots i and j have a distance j - i between them. The score of a pair (i < j) of sightseeing spots is values[i] + values[j] + i - j: the sum of the values of the sightseeing spots, minus the distance between them. Return the maximum score of a pair of sightseeing spots. ","Array,Dynamic Programming","VG9waWNUYWdOb2RlOjU=,VG9waWNUYWdOb2RlOjEz",Medium,58.5,93607,54727,,1564,41,Can you tell the best sightseeing spot in one pass (ie. as you iterate over the input?)  What should we store or keep track of as we iterate to do this?,,
Smallest Integer Divisible by K,smallest-integer-divisible-by-k,1064,"Given a positive integer k, you need to find the length of the smallest positive integer n such that n is divisible by k, and n only contains the digit 1. Return the length of n. If there is no such n, return -1. Note: n may not fit in a 64-bit signed integer. ","Hash Table,Math","VG9waWNUYWdOb2RlOjY=,VG9waWNUYWdOb2RlOjg=",Medium,47.0,117177,55091,,968,799,"11111 = 1111 * 10 + 1
We only need to store remainders modulo K. If we never get a remainder of 0, why would that happen, and how would we know that?",,
Binary String With Substrings Representing 1 To N,binary-string-with-substrings-representing-1-to-n,1065,"Given a binary string s and a positive integer n, return true if the binary representation of all the integers in the range [1, n] are substrings of s, or false otherwise. A substring is a contiguous sequence of characters within a string. ",String,VG9waWNUYWdOb2RlOjEw,Medium,57.9,49096,28428,,247,453,"We only need to check substrings of length at most 30, because 10^9 has 30 bits.",,
Convert to Base -2,convert-to-base-2,1070,"Given an integer n, return a binary string representing its representation in base -2. Note that the returned string should not have leading zeros unless the string is ""0"". ",Math,VG9waWNUYWdOb2RlOjg=,Medium,60.2,30310,18251,,346,225,"Figure out whether you need the ones digit placed or not, then shift by two.",1189,Encode Number
Binary Prefix Divisible By 5,binary-prefix-divisible-by-5,1071,You are given a binary array nums (0-indexed). We define xi as the number whose binary representation is the subarray nums[0..i] (from most-significant-bit to least-significant-bit). Return an array of booleans answer where answer[i] is true if xi is divisible by 5. ,Array,VG9waWNUYWdOb2RlOjU=,Easy,47.5,80946,38484,,514,137,"If X is the first i digits of the array as a binary number, then 2X + A[i] is the first i+1 digits.",,
Next Greater Node In Linked List,next-greater-node-in-linked-list,1072,"You are given the head of a linked list with n nodes. For each node in the list, find the value of the next greater node. That is, for each node, find the value of the first node that is next to it and has a strictly larger value than it. Return an integer array answer where answer[i] is the value of the next greater node of the ith node (1-indexed). If the ith node does not have a next greater node, set answer[i] = 0. ","Array,Linked List,Stack,Monotonic Stack","VG9waWNUYWdOb2RlOjU=,VG9waWNUYWdOb2RlOjc=,VG9waWNUYWdOb2RlOjE1,VG9waWNUYWdOb2RlOjYxMDU0",Medium,59.7,168238,100376,,2114,96,"We can use a stack that stores nodes in monotone decreasing order of value.  When we see a node_j with a larger value, every node_i in the stack has next_larger(node_i) = node_j .",,
Number of Enclaves,number-of-enclaves,1073,"You are given an m x n binary matrix grid, where 0 represents a sea cell and 1 represents a land cell. A move consists of walking from one land cell to another adjacent (4-directionally) land cell or walking off the boundary of the grid. Return the number of land cells in grid for which we cannot walk off the boundary of the grid in any number of moves. ","Array,Depth-First Search,Breadth-First Search,Union Find,Matrix","VG9waWNUYWdOb2RlOjU=,VG9waWNUYWdOb2RlOjIx,VG9waWNUYWdOb2RlOjIy,VG9waWNUYWdOb2RlOjIz,VG9waWNUYWdOb2RlOjYxMDUz",Medium,62.6,82170,51438,,1172,32,"Can you model this problem as a graph problem?  Create n * m + 1 nodes where n * m nodes represents each cell of the map and one extra node to represent the exterior of the map. In the map add edges between neighbors on land cells. And add edges between the exterior and land nodes which are in the boundary.
Return as answer the number of nodes that are not reachable from the exterior node.",,
Remove Outermost Parentheses,remove-outermost-parentheses,1078,"A valid parentheses string is either empty """", ""("" + A + "")"", or A + B, where A and B are valid parentheses strings, and + represents string concatenation. A valid parentheses string s is primitive if it is nonempty, and there does not exist a way to split it into s = A + B, with A and B nonempty valid parentheses strings. Given a valid parentheses string s, consider its primitive decomposition: s = P1 + P2 + ... + Pk, where Pi are primitive valid parentheses strings. Return s after removing the outermost parentheses of every primitive string in the primitive decomposition of s. ","String,Stack","VG9waWNUYWdOb2RlOjEw,VG9waWNUYWdOb2RlOjE1",Easy,79.8,212051,169259,,1241,1163,Can you find the primitive decomposition?  The number of ( and ) characters must be equal.,,
Sum of Root To Leaf Binary Numbers,sum-of-root-to-leaf-binary-numbers,1079,"You are given the root of a binary tree where each node has a value 0 or 1. Each root-to-leaf path represents a binary number starting with the most significant bit. For all leaves in the tree, consider the numbers represented by the path from the root to that leaf. Return the sum of these numbers. The test cases are generated so that the answer fits in a 32-bits integer. ","Tree,Depth-First Search,Binary Tree","VG9waWNUYWdOb2RlOjIw,VG9waWNUYWdOb2RlOjIx,VG9waWNUYWdOb2RlOjYxMDU3",Easy,73.9,215956,159601,,2476,149,"Find each path, then transform that path to an integer in base 10.",,
Camelcase Matching,camelcase-matching,1080,"Given an array of strings queries and a string pattern, return a boolean array answer where answer[i] is true if queries[i] matches pattern, and false otherwise. A query word queries[i] matches pattern if you can insert lowercase English letters pattern so that it equals the query. You may insert each character at any position and you may not insert any characters. ","Two Pointers,String,Trie,String Matching","VG9waWNUYWdOb2RlOjk=,VG9waWNUYWdOb2RlOjEw,VG9waWNUYWdOb2RlOjI3,VG9waWNUYWdOb2RlOjYxMDUy",Medium,59.1,52591,31099,,541,220,"Given a single pattern and word, how can we solve it? One way to do it is using a DP (pos1, pos2) where pos1 is a pointer to the word and pos2 to the pattern and returns true if we can match the pattern with the given word. We have two scenarios: The first one is when `word[pos1] == pattern[pos2]`, then the transition will be just DP(pos1 + 1, pos2 + 1). The second scenario is when `word[pos1]` is lowercase then we can add this character to the pattern so that the transition is just DP(pos1 + 1, pos2)
The case base is `if (pos1 == n && pos2 == m) return true;` Where n and m are the sizes of the strings word and pattern respectively.",,
Video Stitching,video-stitching,1081,"You are given a series of video clips from a sporting event that lasted time seconds. These video clips can be overlapping with each other and have varying lengths. Each video clip is described by an array clips where clips[i] = [starti, endi] indicates that the ith clip started at starti and ended at endi. We can cut these clips into segments freely. Return the minimum number of clips needed so that we can cut the clips into segments that cover the entire sporting event [0, time]. If the task is impossible, return -1. ","Array,Dynamic Programming,Greedy","VG9waWNUYWdOb2RlOjU=,VG9waWNUYWdOb2RlOjEz,VG9waWNUYWdOb2RlOjE3",Medium,50.0,92645,46356,,1179,47,"What if we sort the intervals?  Considering the sorted intervals, how can we solve the problem with dynamic programming? Let's consider a DP(pos, limit) where pos represents the position of the current interval we are gonna take the decision and limit is the current covered area from [0 - limit]. This DP returns the minimum number of taken intervals or infinite if it's not possible to cover the [0 - T] section.",,
Divisor Game,divisor-game,1086,"Alice and Bob take turns playing a game, with Alice starting first. Initially, there is a number n on the chalkboard. On each player's turn, that player makes a move consisting of: Also, if a player cannot make a move, they lose the game. Return true if and only if Alice wins the game, assuming both players play optimally. ","Math,Dynamic Programming,Brainteaser,Game Theory","VG9waWNUYWdOb2RlOjg=,VG9waWNUYWdOb2RlOjEz,VG9waWNUYWdOb2RlOjMy,VG9waWNUYWdOb2RlOjYxMDcz",Easy,66.6,227161,151314,,1272,3042,"If the current number is even, we can always subtract a 1 to make it odd.  If the current number is odd, we must subtract an odd number to make it even.",,
Maximum Difference Between Node and Ancestor,maximum-difference-between-node-and-ancestor,1092,"Given the root of a binary tree, find the maximum value v for which there exist different nodes a and b where v = |a.val - b.val| and a is an ancestor of b. A node a is an ancestor of b if either: any child of a is equal to b or any child of a is an ancestor of b. ","Tree,Depth-First Search,Binary Tree","VG9waWNUYWdOb2RlOjIw,VG9waWNUYWdOb2RlOjIx,VG9waWNUYWdOb2RlOjYxMDU3",Medium,73.1,176300,128961,,2317,64,"For each subtree, find the minimum value and maximum value of its descendants.",,
Longest Arithmetic Subsequence,longest-arithmetic-subsequence,1087,"Given an array nums of integers, return the length of the longest arithmetic subsequence in nums. Recall that a subsequence of an array nums is a list nums[i1], nums[i2], ..., nums[ik] with 0 <= i1 < i2 < ... < ik <= nums.length - 1, and that a sequence seq is arithmetic if seq[i+1] - seq[i] are all the same value (for 0 <= i < seq.length - 1). ","Array,Hash Table,Binary Search,Dynamic Programming","VG9waWNUYWdOb2RlOjU=,VG9waWNUYWdOb2RlOjY=,VG9waWNUYWdOb2RlOjEx,VG9waWNUYWdOb2RlOjEz",Medium,48.2,175733,84715,,2049,97,,,
Recover a Tree From Preorder Traversal,recover-a-tree-from-preorder-traversal,1093,"We run a preorder depth-first search (DFS) on the root of a binary tree. At each node in this traversal, we output D dashes (where D is the depth of this node), then we output the value of this node.  If the depth of a node is D, the depth of its immediate child is D + 1.  The depth of the root node is 0. If a node has only one child, that child is guaranteed to be the left child. Given the output traversal of this traversal, recover the tree and return its root. ","String,Tree,Depth-First Search,Binary Tree","VG9waWNUYWdOb2RlOjEw,VG9waWNUYWdOb2RlOjIw,VG9waWNUYWdOb2RlOjIx,VG9waWNUYWdOb2RlOjYxMDU3",Hard,72.4,47225,34187,,1013,30,"Do an iterative depth first search, parsing dashes from the string to inform you how to link the nodes together.",,
Two City Scheduling,two-city-scheduling,1095,"A company is planning to interview 2n people. Given the array costs where costs[i] = [aCosti, bCosti], the cost of flying the ith person to city a is aCosti, and the cost of flying the ith person to city b is bCosti. Return the minimum cost to fly every person to a city such that exactly n people arrive in each city. ","Array,Greedy,Sorting","VG9waWNUYWdOb2RlOjU=,VG9waWNUYWdOb2RlOjE3,VG9waWNUYWdOb2RlOjYxMDQ5",Medium,63.6,277601,176436,,3594,273,,,
Matrix Cells in Distance Order,matrix-cells-in-distance-order,1094,"You are given four integers row, cols, rCenter, and cCenter. There is a rows x cols matrix and you are on the cell with the coordinates (rCenter, cCenter). Return the coordinates of all cells in the matrix, sorted by their distance from (rCenter, cCenter) from the smallest distance to the largest distance. You may return the answer in any order that satisfies this condition. The distance between two cells (r1, c1) and (r2, c2) is |r1 - r2| + |c1 - c2|. ","Array,Math,Geometry,Sorting,Matrix","VG9waWNUYWdOb2RlOjU=,VG9waWNUYWdOb2RlOjg=,VG9waWNUYWdOb2RlOjM4,VG9waWNUYWdOb2RlOjYxMDQ5,VG9waWNUYWdOb2RlOjYxMDUz",Easy,69.1,60168,41554,,481,218,,2304,Cells in a Range on an Excel Sheet
