Question Title,Question Slug,Question ID,Question Text,Topic Tagged text,Topic Tagged ID,Difficulty Level,Success Rate,total submission,total accepted,company tag,Likes,Dislikes,Hints,Similar Questions ID,Similar Questions Text
Maximum Score From Removing Substrings,maximum-score-from-removing-substrings,1818,You are given a string s and two integers x and y. You can perform two types of operations any number of times. Return the maximum points you can gain after applying the above operations on s. ,"String,Stack,Greedy","VG9waWNUYWdOb2RlOjEw,VG9waWNUYWdOb2RlOjE1,VG9waWNUYWdOb2RlOjE3",Medium,44.9,20889,9371,,394,18,Note that it is always more optimal to take one type of substring before another You can use a stack to handle erasures,2256,Count Words Obtained After Adding a Letter
Construct the Lexicographically Largest Valid Sequence,construct-the-lexicographically-largest-valid-sequence,1819,"Given an integer n, find a sequence that satisfies all of the following: The distance between two numbers on the sequence, a[i] and a[j], is the absolute difference of their indices, |j - i|. Return the lexicographically largest sequence. It is guaranteed that under the given constraints, there is always a solution. A sequence a is lexicographically larger than a sequence b (of the same length) if in the first position where a and b differ, sequence a has a number greater than the corresponding number in b. For example, [0,1,9,0] is lexicographically larger than [0,1,5,6] because the first position they differ is at the third number, and 9 is greater than 5. ","Array,Backtracking","VG9waWNUYWdOb2RlOjU=,VG9waWNUYWdOb2RlOjE0",Medium,51.2,16900,8656,,371,34,Heuristic algorithm may work.,,
Number Of Ways To Reconstruct A Tree,number-of-ways-to-reconstruct-a-tree,1820,"You are given an array pairs, where pairs[i] = [xi, yi], and: Let ways be the number of rooted trees that satisfy the following conditions: Two ways are considered to be different if there is at least one node that has different parents in both ways. Return: A rooted tree is a tree that has a single root node, and all edges are oriented to be outgoing from the root. An ancestor of a node is any node on the path from the root to that node (excluding the node itself). The root has no ancestors. ","Tree,Graph,Topological Sort","VG9waWNUYWdOb2RlOjIw,VG9waWNUYWdOb2RlOjI0,VG9waWNUYWdOb2RlOjI2",Hard,42.1,5755,2425,,117,91,"Think inductively. The first step is to get the root. Obviously, the root should be in pairs with all the nodes. If there isn't exactly one such node, then there are 0 ways. The number of pairs involving a node must be less than or equal to that number of its parent. Actually, if it's equal, then there is not exactly 1 way, because they can be swapped. Recursively, given a set of nodes, get the node with the most pairs, then this must be a root and have no parents in the current set of nodes.",2306,Create Binary Tree From Descriptions
Decode XORed Array,decode-xored-array,1839,"There is a hidden integer array arr that consists of n non-negative integers. It was encoded into another integer array encoded of length n - 1, such that encoded[i] = arr[i] XOR arr[i + 1]. For example, if arr = [1,0,2,1], then encoded = [1,2,3]. You are given the encoded array. You are also given an integer first, that is the first element of arr, i.e. arr[0]. Return the original array arr. It can be proved that the answer exists and is unique. ","Array,Bit Manipulation","VG9waWNUYWdOb2RlOjU=,VG9waWNUYWdOb2RlOjE5",Easy,85.9,79325,68161,,723,134,"Since that encoded[i] = arr[i] XOR arr[i+1], then arr[i+1] = encoded[i] XOR arr[i]. Iterate on i from beginning to end, and set arr[i+1] = encoded[i] XOR arr[i].",,
Swapping Nodes in a Linked List,swapping-nodes-in-a-linked-list,528,"You are given the head of a linked list, and an integer k. Return the head of the linked list after swapping the values of the kth node from the beginning and the kth node from the end (the list is 1-indexed). ","Linked List,Two Pointers","VG9waWNUYWdOb2RlOjc=,VG9waWNUYWdOb2RlOjk=",Medium,68.4,229189,156841,,2691,100,We can transform the linked list to an array this should ease things up After transforming the linked list to an array it becomes as easy as swapping two integers in an array then rebuilding the linked list,"19,24,25","Remove Nth Node From End of List,Swap Nodes in Pairs,Reverse Nodes in k-Group"
Minimize Hamming Distance After Swap Operations,minimize-hamming-distance-after-swap-operations,1840,"You are given two integer arrays, source and target, both of length n. You are also given an array allowedSwaps where each allowedSwaps[i] = [ai, bi] indicates that you are allowed to swap the elements at index ai and index bi (0-indexed) of array source. Note that you can swap elements at a specific pair of indices multiple times and in any order. The Hamming distance of two arrays of the same length, source and target, is the number of positions where the elements are different. Formally, it is the number of indices i for 0 <= i <= n-1 where source[i] != target[i] (0-indexed). Return the minimum Hamming distance of source and target after performing any amount of swap operations on array source. ","Array,Depth-First Search,Union Find","VG9waWNUYWdOb2RlOjU=,VG9waWNUYWdOb2RlOjIx,VG9waWNUYWdOb2RlOjIz",Medium,47.9,25012,11985,,567,17,"The source array can be imagined as a graph where each index is a node and each allowedSwaps[i] is an edge. Nodes within the same component can be freely swapped with each other. For each component, find the number of common elements. The elements that are not in common will contribute to the total Hamming distance.",1308,Smallest String With Swaps
Find Minimum Time to Finish All Jobs,find-minimum-time-to-finish-all-jobs,1825,"You are given an integer array jobs, where jobs[i] is the amount of time it takes to complete the ith job. There are k workers that you can assign jobs to. Each job should be assigned to exactly one worker. The working time of a worker is the sum of the time it takes to complete all jobs assigned to them. Your goal is to devise an optimal assignment such that the maximum working time of any worker is minimized. Return the minimum possible maximum working time of any assignment. ","Array,Dynamic Programming,Backtracking,Bit Manipulation,Bitmask","VG9waWNUYWdOb2RlOjU=,VG9waWNUYWdOb2RlOjEz,VG9waWNUYWdOb2RlOjE0,VG9waWNUYWdOb2RlOjE5,VG9waWNUYWdOb2RlOjYxMDc4",Hard,42.9,32104,13776,,491,14,We can select a subset of tasks and assign it to a worker then solve the subproblem on the remaining tasks,2114,Minimum Number of Work Sessions to Finish the Tasks
Checking Existence of Edge Length Limited Paths II,checking-existence-of-edge-length-limited-paths-ii,1865,,"Union Find,Graph,Minimum Spanning Tree","VG9waWNUYWdOb2RlOjIz,VG9waWNUYWdOb2RlOjI0,VG9waWNUYWdOb2RlOjYxMDgz",Hard,52.6,3069,1613,,50,6,"Find the minimum spanning tree of the given graph. Root the tree in an arbitrary node and calculate the maximum weight of the edge from each node to the chosen root. To answer a query, find the lca between the two nodes, and find the maximum weight from each of the query nodes to their lca and compare it to the given limit.",1815,Checking Existence of Edge Length Limited Paths
Number Of Rectangles That Can Form The Largest Square,number-of-rectangles-that-can-form-the-largest-square,1843,"You are given an array rectangles where rectangles[i] = [li, wi] represents the ith rectangle of length li and width wi. You can cut the ith rectangle to form a square with a side length of k if both k <= li and k <= wi. For example, if you have a rectangle [4,6], you can cut it to get a square with a side length of at most 4. Let maxLen be the side length of the largest square you can obtain from any of the given rectangles. Return the number of rectangles that can make a square with a side length of maxLen. ",Array,VG9waWNUYWdOb2RlOjU=,Easy,78.8,51652,40686,,333,40,"What is the length of the largest square the can be cut out of some rectangle? It'll be equal to min(rectangle.length, rectangle.width). Replace each rectangle with this value. Calculate maxSize by iterating over the given rectangles and maximizing the answer with their values denoted in the first hint. Then iterate again on the rectangles and calculate the number whose values = maxSize.",,
Tuple with Same Product,tuple-with-same-product,1364,"Given an array nums of distinct positive integers, return the number of tuples (a, b, c, d) such that a * b = c * d where a, b, c, and d are elements of nums, and a != b != c != d. ","Array,Hash Table","VG9waWNUYWdOb2RlOjU=,VG9waWNUYWdOb2RlOjY=",Medium,60.5,30445,18406,,406,19,Note that all of the integers are distinct. This means that each time a product is formed it must be formed by two unique integers. Count the frequency of each product of 2 distinct numbers. Then calculate the permutations formed.,,
Largest Submatrix With Rearrangements,largest-submatrix-with-rearrangements,1845,"You are given a binary matrix matrix of size m x n, and you are allowed to rearrange the columns of the matrix in any order. Return the area of the largest submatrix within matrix where every element of the submatrix is 1 after reordering the columns optimally. ","Array,Greedy,Sorting,Matrix","VG9waWNUYWdOb2RlOjU=,VG9waWNUYWdOb2RlOjE3,VG9waWNUYWdOb2RlOjYxMDQ5,VG9waWNUYWdOb2RlOjYxMDUz",Medium,60.4,19339,11682,,641,16,"For each column, find the number of consecutive ones ending at each position. For each row, sort the cumulative ones in non-increasing order and ""fit"" the largest submatrix.",695,Max Area of Island
Cat and Mouse II,cat-and-mouse-ii,1727,"A game is played by a cat and a mouse named Cat and Mouse. The environment is represented by a grid of size rows x cols, where each element is a wall, floor, player (Cat, Mouse), or food. Mouse and Cat play according to the following rules: The game can end in 4 ways: Given a rows x cols matrix grid and two integers catJump and mouseJump, return true if Mouse can win the game if both Cat and Mouse play optimally, otherwise return false. ","Math,Dynamic Programming,Breadth-First Search,Graph,Memoization,Game Theory","VG9waWNUYWdOb2RlOjg=,VG9waWNUYWdOb2RlOjEz,VG9waWNUYWdOb2RlOjIy,VG9waWNUYWdOb2RlOjI0,VG9waWNUYWdOb2RlOjMz,VG9waWNUYWdOb2RlOjYxMDcz",Hard,41.2,11200,4620,,151,27,"Try working backward: consider all trivial states you know to be winning or losing, and work backward to determine which other states can be labeled as winning or losing.","805,949","Escape The Ghosts,Cat and Mouse"
Find Followers Count,find-followers-count,1877,"Table: Followers  Write an SQL query that will, for each user, return the number of followers. Return the result table ordered by user_id. The query result format is in the following example. ",Database,VG9waWNUYWdOb2RlOjYxMDQz,Easy,71.4,16368,11680,,49,8,,,
Shortest Path to Get Food,shortest-path-to-get-food,550,,"Array,Breadth-First Search,Matrix","VG9waWNUYWdOb2RlOjU=,VG9waWNUYWdOb2RlOjIy,VG9waWNUYWdOb2RlOjYxMDUz",Medium,54.3,53077,28812,,361,16,"Run BFS starting from the '*' position. Keep the current number of the steps as a state in the queue. The first time you reach a food, return the number of steps as the answer. In case the queue is empty and you still did not manage to reach a food, return -1.","542,1414","01 Matrix,Shortest Path in a Grid with Obstacles Elimination"
The Number of Employees Which Report to Each Employee,the-number-of-employees-which-report-to-each-employee,1882,,Database,VG9waWNUYWdOb2RlOjYxMDQz,Easy,49.1,19329,9495,,55,14,,,
Find the Highest Altitude,find-the-highest-altitude,1833,There is a biker going on a road trip. The road trip consists of n + 1 points at different altitudes. The biker starts his trip on point 0 with altitude equal 0. You are given an integer array gain of length n where gain[i] is the net gain in altitude between points i​​​​​​ and i + 1 for all (0 <= i < n). Return the highest altitude of a point. ,"Array,Prefix Sum","VG9waWNUYWdOb2RlOjU=,VG9waWNUYWdOb2RlOjYxMDY4",Easy,78.9,88185,69592,,762,78,Let's note that the altitude of an element is the sum of gains of all the elements behind it Getting the altitudes can be done by getting the prefix sum array of the given array,,
Minimum Number of People to Teach,minimum-number-of-people-to-teach,1834,"On a social network consisting of m users and some friendships between users, two users can communicate with each other if they know a common language. You are given an integer n, an array languages, and an array friendships where: You can choose one language and teach it to some users so that all friends can communicate with each other. Return the minimum number of users you need to teach. ","Array,Greedy","VG9waWNUYWdOb2RlOjU=,VG9waWNUYWdOb2RlOjE3",Medium,40.7,14794,6027,,143,299,You can just use brute force and find out for each language the number of users you need to teach Note that a user can appear in multiple friendships but you need to teach that user only once,,
Decode XORed Permutation,decode-xored-permutation,1835,"There is an integer array perm that is a permutation of the first n positive integers, where n is always odd. It was encoded into another integer array encoded of length n - 1, such that encoded[i] = perm[i] XOR perm[i + 1]. For example, if perm = [1,3,2], then encoded = [2,1]. Given the encoded array, return the original array perm. It is guaranteed that the answer exists and is unique. ","Array,Bit Manipulation","VG9waWNUYWdOb2RlOjU=,VG9waWNUYWdOb2RlOjE5",Medium,60.7,14967,9090,,485,18,"Compute the XOR of the numbers between 1 and n, and think about how it can be used. Let it be x. Think why n is odd. perm[0] = x XOR encoded[1] XOR encoded[3] XOR encoded[5] ... perm[i] = perm[i-1] XOR encoded[i-1]",,
Count Ways to Make Array With Product,count-ways-to-make-array-with-product,1836,"You are given a 2D integer array, queries. For each queries[i], where queries[i] = [ni, ki], find the number of different ways you can place positive integers into an array of size ni such that the product of the integers is ki. As the number of ways may be too large, the answer to the ith query is the number of ways modulo 109 + 7. Return an integer array answer where answer.length == queries.length, and answer[i] is the answer to the ith query. ","Array,Math,Dynamic Programming","VG9waWNUYWdOb2RlOjU=,VG9waWNUYWdOb2RlOjg=,VG9waWNUYWdOb2RlOjEz",Hard,49.5,6382,3160,,154,25,"Prime-factorize ki and count how many ways you can distribute the primes among the ni positions. After prime factorizing ki, suppose there are x amount of prime factor. There are (x + n - 1) choose (n - 1) ways to distribute the x prime factors into k positions, allowing repetitions.",,
Latest Time by Replacing Hidden Digits,latest-time-by-replacing-hidden-digits,1858,"You are given a string time in the form of  hh:mm, where some of the digits in the string are hidden (represented by ?). The valid times are those inclusively between 00:00 and 23:59. Return the latest valid time you can get from time by replacing the hidden digits. ","String,Greedy","VG9waWNUYWdOb2RlOjEw,VG9waWNUYWdOb2RlOjE3",Easy,42.1,52291,21989,,202,121,"Trying out all possible solutions from biggest to smallest would fit in the time limit. To check if the solution is okay, you need to find out if it's valid and matches every character",,
Change Minimum Characters to Satisfy One of Three Conditions,change-minimum-characters-to-satisfy-one-of-three-conditions,1859,"You are given two strings a and b that consist of lowercase letters. In one operation, you can change any character in a or b to any lowercase letter. Your goal is to satisfy one of the following three conditions: Return the minimum number of operations needed to achieve your goal. ","Hash Table,String,Counting,Prefix Sum","VG9waWNUYWdOb2RlOjY=,VG9waWNUYWdOb2RlOjEw,VG9waWNUYWdOb2RlOjYxMDYy,VG9waWNUYWdOb2RlOjYxMDY4",Medium,34.2,27038,9241,,235,257,"Iterate on each letter in the alphabet, and check the smallest number of operations needed to make it one of the following: the largest letter in a and smaller than the smallest one in b, vice versa, or let a and b consist only of this letter. For the first 2 conditions, take care that you can only change characters to lowercase letters, so you can't make 'z' the smallest letter in one of the strings or 'a' the largest letter in one of them.",,
Find Kth Largest XOR Coordinate Value,find-kth-largest-xor-coordinate-value,1860,"You are given a 2D matrix of size m x n, consisting of non-negative integers. You are also given an integer k. The value of coordinate (a, b) of the matrix is the XOR of all matrix[i][j] where 0 <= i <= a < m and 0 <= j <= b < n (0-indexed). Find the kth largest value (1-indexed) of all the coordinates of matrix. ","Array,Divide and Conquer,Bit Manipulation,Heap (Priority Queue),Matrix,Prefix Sum,Quickselect","VG9waWNUYWdOb2RlOjU=,VG9waWNUYWdOb2RlOjEy,VG9waWNUYWdOb2RlOjE5,VG9waWNUYWdOb2RlOjYxMDUw,VG9waWNUYWdOb2RlOjYxMDUz,VG9waWNUYWdOb2RlOjYxMDY4,VG9waWNUYWdOb2RlOjYxMDY5",Medium,62.1,22787,14142,,306,45,Use a 2D prefix sum to precalculate the xor-sum of the upper left submatrix.,,
Building Boxes,building-boxes,1861,"You have a cubic storeroom where the width, length, and height of the room are all equal to n units. You are asked to place n boxes in this room where each box is a cube of unit side length. There are however some rules to placing the boxes: Given an integer n, return the minimum possible number of boxes touching the floor. ","Math,Binary Search,Greedy","VG9waWNUYWdOb2RlOjg=,VG9waWNUYWdOb2RlOjEx,VG9waWNUYWdOb2RlOjE3",Hard,50.8,9455,4806,,198,35,"Suppose We can put m boxes on the floor, within all the ways to put the boxes, what’s the maximum number of boxes we can put in? The first box should always start in the corner",,
Find Distance in a Binary Tree,find-distance-in-a-binary-tree,1883,,"Hash Table,Tree,Depth-First Search,Breadth-First Search,Binary Tree","VG9waWNUYWdOb2RlOjY=,VG9waWNUYWdOb2RlOjIw,VG9waWNUYWdOb2RlOjIx,VG9waWNUYWdOb2RlOjIy,VG9waWNUYWdOb2RlOjYxMDU3",Medium,68.4,15733,10755,,232,10,Get the LCA of p and q. The answer is the sum of distances between p-LCA and q-LCA,2217,Step-By-Step Directions From a Binary Tree Node to Another
Find Total Time Spent by Each Employee,find-total-time-spent-by-each-employee,1892,"Table: Employees  Write an SQL query to calculate the total time in minutes spent by each employee on each day at the office. Note that within one day, an employee can enter and leave more than once. The time spent in the office for a single entry is out_time - in_time. Return the result table in any order. The query result format is in the following example. ",Database,VG9waWNUYWdOb2RlOjYxMDQz,Easy,91.5,19939,18249,,97,5,,,
Maximum Number of Balls in a Box,maximum-number-of-balls-in-a-box,1844,"You are working in a ball factory where you have n balls numbered from lowLimit up to highLimit inclusive (i.e., n == highLimit - lowLimit + 1), and an infinite number of boxes numbered from 1 to infinity. Your job at this factory is to put each ball in the box with a number equal to the sum of digits of the ball's number. For example, the ball number 321 will be put in the box number 3 + 2 + 1 = 6 and the ball number 10 will be put in the box number 1 + 0 = 1. Given two integers lowLimit and highLimit, return the number of balls in the box with the most balls. ","Hash Table,Math,Counting","VG9waWNUYWdOb2RlOjY=,VG9waWNUYWdOb2RlOjg=,VG9waWNUYWdOb2RlOjYxMDYy",Easy,73.7,51413,37887,,362,85,Note that both lowLimit and highLimit are of small constraints so you can iterate on all nubmer between them You can simulate the boxes by counting for each box the number of balls with digit sum equal to that box number,,
Restore the Array From Adjacent Pairs,restore-the-array-from-adjacent-pairs,1866,"There is an integer array nums that consists of n unique elements, but you have forgotten it. However, you do remember every pair of adjacent elements in nums. You are given a 2D integer array adjacentPairs of size n - 1 where each adjacentPairs[i] = [ui, vi] indicates that the elements ui and vi are adjacent in nums. It is guaranteed that every adjacent pair of elements nums[i] and nums[i+1] will exist in adjacentPairs, either as [nums[i], nums[i+1]] or [nums[i+1], nums[i]]. The pairs can appear in any order. Return the original array nums. If there are multiple solutions, return any of them. ","Array,Hash Table","VG9waWNUYWdOb2RlOjU=,VG9waWNUYWdOb2RlOjY=",Medium,68.1,36826,25075,,624,11,Find the first element of nums - it will only appear once in adjacentPairs. The adjacent pairs are like edges of a graph. Perform a depth-first search from the first element.,,
Can You Eat Your Favorite Candy on Your Favorite Day?,can-you-eat-your-favorite-candy-on-your-favorite-day,1872,"You are given a (0-indexed) array of positive integers candiesCount where candiesCount[i] represents the number of candies of the ith type you have. You are also given a 2D array queries where queries[i] = [favoriteTypei, favoriteDayi, dailyCapi]. You play a game with the following rules: Construct a boolean array answer such that answer.length == queries.length and answer[i] is true if you can eat a candy of type favoriteTypei on day favoriteDayi without eating more than dailyCapi candies on any day, and false otherwise. Note that you can eat different types of candy on the same day, provided that you follow rule 2. Return the constructed array answer. ","Array,Prefix Sum","VG9waWNUYWdOb2RlOjU=,VG9waWNUYWdOb2RlOjYxMDY4",Medium,32.2,24388,7862,,85,265,"The query is true if and only if your favorite day is in between the earliest and latest possible days to eat your favorite candy. To get the earliest day, you need to eat dailyCap candies every day. To get the latest day, you need to eat 1 candy every day. The latest possible day is the total number of candies with a smaller type plus the number of your favorite candy minus 1. The earliest possible day that you can eat your favorite candy is the total number of candies with a smaller type divided by dailyCap.",,
Palindrome Partitioning IV,palindrome-partitioning-iv,1871,"Given a string s, return true if it is possible to split the string s into three non-empty palindromic substrings. Otherwise, return false.​​​​​ A string is said to be palindrome if it the same string when reversed. ","String,Dynamic Programming","VG9waWNUYWdOb2RlOjEw,VG9waWNUYWdOb2RlOjEz",Hard,49.0,29581,14483,,485,14,Preprocess checking palindromes in O(1) Note that one string is a prefix and another one is a suffix you can try brute forcing the rest,"131,132,1403","Palindrome Partitioning,Palindrome Partitioning II,Palindrome Partitioning III"
Maximum Subarray Sum After One Operation,maximum-subarray-sum-after-one-operation,1893,,"Array,Dynamic Programming","VG9waWNUYWdOb2RlOjU=,VG9waWNUYWdOb2RlOjEz",Medium,62.1,8712,5412,,196,4,"Think about dynamic programming Define an array dp[nums.length][2], where dp[i][0] is the max subarray sum including nums[i] and without squaring any element. dp[i][1] is the max subarray sum including nums[i] and having only one element squared.",53,Maximum Subarray
Leetflex Banned Accounts,leetflex-banned-accounts,1898,,Database,VG9waWNUYWdOb2RlOjYxMDQz,Medium,67.5,11238,7588,,71,5,,,
Sum of Unique Elements,sum-of-unique-elements,1848,You are given an integer array nums. The unique elements of an array are the elements that appear exactly once in the array. Return the sum of all the unique elements of nums. ,"Array,Hash Table,Counting","VG9waWNUYWdOb2RlOjU=,VG9waWNUYWdOb2RlOjY=,VG9waWNUYWdOb2RlOjYxMDYy",Easy,75.5,96539,72919,,721,17,Use a dictionary to count the frequency of each number.,,
Maximum Absolute Sum of Any Subarray,maximum-absolute-sum-of-any-subarray,1849,"You are given an integer array nums. The absolute sum of a subarray [numsl, numsl+1, ..., numsr-1, numsr] is abs(numsl + numsl+1 + ... + numsr-1 + numsr). Return the maximum absolute sum of any (possibly empty) subarray of nums. Note that abs(x) is defined as follows: ","Array,Dynamic Programming","VG9waWNUYWdOb2RlOjU=,VG9waWNUYWdOb2RlOjEz",Medium,56.9,37056,21096,,700,10,"What if we asked for maximum sum, not absolute sum? It's a standard problem that can be solved by Kadane's algorithm. The key idea is the max absolute sum will be either the max sum or the min sum. So just run kadane twice, once calculating the max sum and once calculating the min sum.",53,Maximum Subarray
Minimum Length of String After Deleting Similar Ends,minimum-length-of-string-after-deleting-similar-ends,1850,"Given a string s consisting only of characters 'a', 'b', and 'c'. You are asked to apply the following algorithm on the string any number of times: Return the minimum length of s after performing the above operation any number of times (possibly zero times). ","Two Pointers,String","VG9waWNUYWdOb2RlOjk=,VG9waWNUYWdOb2RlOjEw",Medium,43.2,31319,13527,,273,18,"If both ends have distinct characters, no more operations can be made. Otherwise, the only operation is to remove all of the same characters from both ends. We will do this as many times as we can. Note that if the length is equal 1 the answer is 1",,
