Question Title,Question Slug,Question ID,Question Text,Topic Tagged text,Topic Tagged ID,Difficulty Level,Success Rate,total submission,total accepted,company tag,Likes,Dislikes,Hints,Similar Questions ID,Similar Questions Text
Count Pairs Of Nodes,count-pairs-of-nodes,1891,"You are given an undirected graph defined by an integer n, the number of nodes, and a 2D integer array edges, the edges in the graph, where edges[i] = [ui, vi] indicates that there is an undirected edge between ui and vi. You are also given an integer array queries. Let incident(a, b) be defined as the number of edges that are connected to either node a or b. The answer to the jth query is the number of pairs of nodes (a, b) that satisfy both of the following conditions: Return an array answers such that answers.length == queries.length and answers[j] is the answer of the jth query. Note that there can be multiple edges between the same two nodes. ","Two Pointers,Binary Search,Graph","VG9waWNUYWdOb2RlOjk=,VG9waWNUYWdOb2RlOjEx,VG9waWNUYWdOb2RlOjI0",Hard,37.4,11504,4298,,195,122,"We want to count pairs (x,y) such that degree[x] + degree[y] - occurrences(x,y) > k Think about iterating on x, and counting the number of valid y to pair with x. You can consider at first that the (- occurrences(x,y)) isn't there, or it is 0 at first for all y. Count the valid y this way. Then you can iterate on the neighbors of x, let that neighbor be y, and update occurrences(x,y). When you update occurrences(x,y), the left-hand side decreases. Once it reaches k, then y is not valid for x anymore, so you should decrease the answer by 1.",,
Grand Slam Titles,grand-slam-titles,1932,,Database,VG9waWNUYWdOb2RlOjYxMDQz,Medium,89.3,11327,10120,,96,2,,,
Check if Binary String Has at Most One Segment of Ones,check-if-binary-string-has-at-most-one-segment-of-ones,1910,"Given a binary string s ​​​​​without leading zeros, return true​​​ if s contains at most one contiguous segment of ones. Otherwise, return false. ",String,VG9waWNUYWdOb2RlOjEw,Easy,40.8,57619,23535,,163,520,It's guaranteed to have at least one segment The string size is small so you can count all segments of ones with no that have no adjacent ones.,1999,Longer Contiguous Segments of Ones than Zeros
Minimum Elements to Add to Form a Given Sum,minimum-elements-to-add-to-form-a-given-sum,1911,"You are given an integer array nums and two integers limit and goal. The array nums has an interesting property that abs(nums[i]) <= limit. Return the minimum number of elements you need to add to make the sum of the array equal to goal. The array must maintain its property that abs(nums[i]) <= limit. Note that abs(x) equals x if x >= 0, and -x otherwise. ","Array,Greedy","VG9waWNUYWdOb2RlOjU=,VG9waWNUYWdOb2RlOjE3",Medium,41.6,33964,14123,,150,145,"Try thinking about the problem as if the array is empty. Then you only need to form goal using elements whose absolute value is <= limit. You can greedily set all of the elements except one to limit or -limit, so the number of elements you need is ceil(abs(goal)/ limit). You can ""normalize"" goal by offsetting it by the sum of the array. For example, if the goal is 5 and the sum is -3, then it's exactly the same as if the goal is 8 and the array is empty. The answer is ceil(abs(goal-sum)/limit) = (abs(goal-sum)+limit-1) / limit.",,
Number of Restricted Paths From First to Last Node,number-of-restricted-paths-from-first-to-last-node,1912,"There is an undirected weighted connected graph. You are given a positive integer n which denotes that the graph has n nodes labeled from 1 to n, and an array edges where each edges[i] = [ui, vi, weighti] denotes that there is an edge between nodes ui and vi with weight equal to weighti. A path from node start to node end is a sequence of nodes [z0, z1, z2, ..., zk] such that z0 = start and zk = end and there is an edge between zi and zi+1 where 0 <= i <= k-1. The distance of a path is the sum of the weights on the edges of the path. Let distanceToLastNode(x) denote the shortest distance of a path between node n and node x. A restricted path is a path that also satisfies that distanceToLastNode(zi) > distanceToLastNode(zi+1) where 0 <= i <= k-1. Return the number of restricted paths from node 1 to node n. Since that number may be too large, return it modulo 109 + 7. ","Dynamic Programming,Graph,Topological Sort,Heap (Priority Queue),Shortest Path","VG9waWNUYWdOb2RlOjEz,VG9waWNUYWdOb2RlOjI0,VG9waWNUYWdOb2RlOjI2,VG9waWNUYWdOb2RlOjYxMDUw,VG9waWNUYWdOb2RlOjYxMDc2",Medium,38.6,32401,12491,,579,101,"Run a Dijkstra from node numbered n to compute distance from the last node. Consider all edges [u, v] one by one and direct them such that distance of u to n > distance of v to n. If both u and v are at the same distance from n, discard this edge. Now this problem reduces to computing the number of paths from 1 to n in a DAG, a standard DP problem.",1431,All Ancestors of a Node in a Directed Acyclic Graph
Make the XOR of All Segments Equal to Zero,make-the-xor-of-all-segments-equal-to-zero,1913,"You are given an array nums​​​ and an integer k​​​​​. The XOR of a segment [left, right] where left <= right is the XOR of all the elements with indices between left and right, inclusive: nums[left] XOR nums[left+1] XOR ... XOR nums[right]. Return the minimum number of elements to change in the array such that the XOR of all segments of size k​​​​​​ is equal to zero. ","Array,Dynamic Programming,Bit Manipulation","VG9waWNUYWdOb2RlOjU=,VG9waWNUYWdOb2RlOjEz,VG9waWNUYWdOb2RlOjE5",Hard,39.1,9023,3529,,257,13,"Let's note that for the XOR of all segments with size K to be equal to zeros, nums[i] has to be equal to nums[i+k] Basically, we need to make the first K elements have XOR = 0 and then modify them.",,
Maximize the Beauty of the Garden,maximize-the-beauty-of-the-garden,1937,,"Array,Greedy,Prefix Sum","VG9waWNUYWdOb2RlOjU=,VG9waWNUYWdOb2RlOjE3,VG9waWNUYWdOb2RlOjYxMDY4",Hard,67.2,2052,1378,,45,4,Consider every possible beauty and its first and last index in flowers. Remove all flowers with negative beauties within those indices.,,
Primary Department for Each Employee,primary-department-for-each-employee,1942,,Database,VG9waWNUYWdOb2RlOjYxMDQz,Easy,79.1,11829,9362,,58,27,,,
Check if One String Swap Can Make Strings Equal,check-if-one-string-swap-can-make-strings-equal,1915,"You are given two strings s1 and s2 of equal length. A string swap is an operation where you choose two indices in a string (not necessarily different) and swap the characters at these indices. Return true if it is possible to make both strings equal by performing at most one string swap on exactly one of the strings. Otherwise, return false. ","Hash Table,String,Counting","VG9waWNUYWdOb2RlOjY=,VG9waWNUYWdOb2RlOjEw,VG9waWNUYWdOb2RlOjYxMDYy",Easy,45.9,84230,38673,,452,18,The answer is false if the number of nonequal positions in the strings is not equal to 0 or 2. Check that these positions have the same set of characters.,889,Buddy Strings
Find Center of Star Graph,find-center-of-star-graph,1916,"There is an undirected star graph consisting of n nodes labeled from 1 to n. A star graph is a graph where there is one center node and exactly n - 1 edges that connect the center node with every other node. You are given a 2D integer array edges where each edges[i] = [ui, vi] indicates that there is an edge between the nodes ui and vi. Return the center of the given star graph. ",Graph,VG9waWNUYWdOb2RlOjI0,Easy,83.6,93407,78108,,530,70,"The center is the only node that has more than one edge. The center is also connected to all other nodes. Any two edges must have a common node, which is the center.",,
Maximum Average Pass Ratio,maximum-average-pass-ratio,1917,"There is a school that has classes of students and each class will be having a final exam. You are given a 2D integer array classes, where classes[i] = [passi, totali]. You know beforehand that in the ith class, there are totali total students, but only passi number of students will pass the exam. You are also given an integer extraStudents. There are another extraStudents brilliant students that are guaranteed to pass the exam of any class they are assigned to. You want to assign each of the extraStudents students to a class in a way that maximizes the average pass ratio across all the classes. The pass ratio of a class is equal to the number of students of the class that will pass the exam divided by the total number of students of the class. The average pass ratio is the sum of pass ratios of all the classes divided by the number of the classes. Return the maximum possible average pass ratio after assigning the extraStudents students. Answers within 10-5 of the actual answer will be accepted. ","Array,Greedy,Heap (Priority Queue)","VG9waWNUYWdOb2RlOjU=,VG9waWNUYWdOb2RlOjE3,VG9waWNUYWdOb2RlOjYxMDUw",Medium,50.7,29069,14741,,474,58,"Pay attention to how much the pass ratio changes when you add a student to the class. If you keep adding students, what happens to the change in pass ratio? The more students you add to a class, the smaller the change in pass ratio becomes. Since the change in the pass ratio is always decreasing with the more students you add, then the very first student you add to each class is the one that makes the biggest change in the pass ratio. Because each class's pass ratio is weighted equally, it's always optimal to put the student in the class that makes the biggest change among all the other classes. Keep a max heap of the current class sizes and order them by the change in pass ratio. For each extra student, take the top of the heap, update the class size, and put it back in the heap.",,
Maximum Score of a Good Subarray,maximum-score-of-a-good-subarray,1918,"You are given an array of integers nums (0-indexed) and an integer k. The score of a subarray (i, j) is defined as min(nums[i], nums[i+1], ..., nums[j]) * (j - i + 1). A good subarray is a subarray where i <= k <= j. Return the maximum possible score of a good subarray. ","Array,Two Pointers,Binary Search,Stack,Monotonic Stack","VG9waWNUYWdOb2RlOjU=,VG9waWNUYWdOb2RlOjk=,VG9waWNUYWdOb2RlOjEx,VG9waWNUYWdOb2RlOjE1,VG9waWNUYWdOb2RlOjYxMDU0",Hard,51.5,25890,13338,,580,24,"Try thinking about the prefix before index k and the suffix after index k as two separate arrays. Using two pointers or binary search, we can find the maximum prefix of each array where the numbers are less than or equal to a certain value",84,Largest Rectangle in Histogram
Count Pairs of Equal Substrings With Minimum Difference,count-pairs-of-equal-substrings-with-minimum-difference,1943,,"Hash Table,String,Greedy","VG9waWNUYWdOb2RlOjY=,VG9waWNUYWdOb2RlOjEw,VG9waWNUYWdOb2RlOjE3",Medium,65.0,1907,1239,,30,37,"If the chosen substrings are of size larger than 1, then you can remove all but the first character from both substrings, and you'll get equal substrings of size 1, with the same a but less j. Hence, it's always optimal to choose substrings of size 1. If you choose a specific letter, then it's optimal to choose its first occurrence in firstString, and its last occurrence in secondString, to minimize j-a.",,
Rearrange Products Table,rearrange-products-table,1948,"Table: Products  Write an SQL query to rearrange the Products table so that each row has (product_id, store, price). If a product is not available in a store, do not include a row with that product_id and store combination in the result table. Return the result table in any order. The query result format is in the following example. ",Database,VG9waWNUYWdOb2RlOjYxMDQz,Easy,90.4,13374,12095,,113,6,,1926,Product's Price for Each Store
Second Largest Digit in a String,second-largest-digit-in-a-string,1904,"Given an alphanumeric string s, return the second largest numerical digit that appears in s, or -1 if it does not exist. An alphanumeric string is a string consisting of lowercase English letters and digits. ","Hash Table,String","VG9waWNUYWdOb2RlOjY=,VG9waWNUYWdOb2RlOjEw",Easy,49.0,50676,24842,,245,70,"First of all, get the distinct characters since we are only interested in those Let's note that there might not be any digits.",,
Design Authentication Manager,design-authentication-manager,1905,"There is an authentication system that works with authentication tokens. For each session, the user will receive a new authentication token that will expire timeToLive seconds after the currentTime. If the token is renewed, the expiry time will be extended to expire timeToLive seconds after the (potentially different) currentTime. Implement the AuthenticationManager class: Note that if a token expires at time t, and another action happens on time t (renew or countUnexpiredTokens), the expiration takes place before the other actions. ","Hash Table,Design","VG9waWNUYWdOb2RlOjY=,VG9waWNUYWdOb2RlOjI1",Medium,53.6,19110,10240,,156,29,"Using a map, track the expiry times of the tokens. When generating a new token, add it to the map with its expiry time. When renewing a token, check if it's on the map and has not expired yet. If so, update its expiry time. To count unexpired tokens, iterate on the map and check for each token if it's not expired yet.",,
Maximum Number of Consecutive Values You Can Make,maximum-number-of-consecutive-values-you-can-make,1930,You are given an integer array coins of length n which represents the n coins that you own. The value of the ith coin is coins[i]. You can make some value x if you can choose some of your n coins such that their values sum up to x. Return the maximum number of consecutive integer values that you can make with your coins starting from and including 0. Note that you may have multiple coins of the same value. ,"Array,Greedy","VG9waWNUYWdOb2RlOjU=,VG9waWNUYWdOb2RlOjE3",Medium,51.7,18646,9633,,468,36,"If you can make the first x values and you have a value v, then you can make all the values ≤ v + x Sort the array of coins. You can always make the value 0 so you can start with x = 0. Process the values starting from the smallest and stop when there is a value that cannot be achieved with the current x.",330,Patching Array
Maximize Score After N Operations,maximize-score-after-n-operations,1906,"You are given nums, an array of positive integers of size 2 * n. You must perform n operations on this array. In the ith operation (1-indexed), you will: Return the maximum score you can receive after performing n operations. The function gcd(x, y) is the greatest common divisor of x and y. ","Array,Math,Dynamic Programming,Backtracking,Bit Manipulation,Number Theory,Bitmask","VG9waWNUYWdOb2RlOjU=,VG9waWNUYWdOb2RlOjg=,VG9waWNUYWdOb2RlOjEz,VG9waWNUYWdOb2RlOjE0,VG9waWNUYWdOb2RlOjE5,VG9waWNUYWdOb2RlOjYxMDY3,VG9waWNUYWdOb2RlOjYxMDc4",Hard,46.4,25212,11706,,368,35,Find every way to split the array until n groups of 2. Brute force recursion is acceptable. Calculate the gcd of every pair and greedily multiply the largest gcds.,,
Maximum Ascending Subarray Sum,maximum-ascending-subarray-sum,1927,"Given an array of positive integers nums, return the maximum possible sum of an ascending subarray in nums. A subarray is defined as a contiguous sequence of numbers in an array. A subarray [numsl, numsl+1, ..., numsr-1, numsr] is ascending if for all i where l <= i < r, numsi  < numsi+1. Note that a subarray of size 1 is ascending. ",Array,VG9waWNUYWdOb2RlOjU=,Easy,64.4,45315,29180,,374,13,It is fast enough to check all possible subarrays The end of each ascending subarray will be the start of the next,2205,Find Good Days to Rob the Bank
Number of Orders in the Backlog,number-of-orders-in-the-backlog,1928,"You are given a 2D integer array orders, where each orders[i] = [pricei, amounti, orderTypei] denotes that amounti orders have been placed of type orderTypei at the price pricei. The orderTypei is: Note that orders[i] represents a batch of amounti independent orders with the same price and order type. All orders represented by orders[i] will be placed before all orders represented by orders[i+1] for all valid i. There is a backlog that consists of orders that have not been executed. The backlog is initially empty. When an order is placed, the following happens: Return the total amount of orders in the backlog after placing all the orders from the input. Since this number can be large, return it modulo 109 + 7. ","Array,Heap (Priority Queue),Simulation","VG9waWNUYWdOb2RlOjU=,VG9waWNUYWdOb2RlOjYxMDUw,VG9waWNUYWdOb2RlOjYxMDU1",Medium,45.9,25682,11779,,172,179,"Store the backlog buy and sell orders in two heaps, the buy orders in a max heap by price and the sell orders in a min heap by price. Store the orders in batches and update the fields according to new incoming orders. Each batch should only take 1 ""slot"" in the heap.",,
Maximum Value at a Given Index in a Bounded Array,maximum-value-at-a-given-index-in-a-bounded-array,1929,"You are given three positive integers: n, index, and maxSum. You want to construct an array nums (0-indexed) that satisfies the following conditions: Return nums[index] of the constructed array. Note that abs(x) equals x if x >= 0, and -x otherwise. ","Binary Search,Greedy","VG9waWNUYWdOb2RlOjEx,VG9waWNUYWdOb2RlOjE3",Medium,29.8,33233,9911,,508,70,"What if the problem was instead determining if you could generate a valid array with nums[index] == target? To generate the array, set nums[index] to target, nums[index-i] to target-i, and nums[index+i] to target-i. Then, this will give the minimum possible sum, so check if the sum is less than or equal to maxSum. n is too large to actually generate the array, so you can use the formula 1 + 2 + ... + n = n * (n+1) / 2 to quickly find the sum of nums[0...index] and nums[index...n-1]. Binary search for the target. If it is possible, then move the lower bound up. Otherwise, move the upper bound down.",,
Count Pairs With XOR in a Range,count-pairs-with-xor-in-a-range,1907,"Given a (0-indexed) integer array nums and two integers low and high, return the number of nice pairs. A nice pair is a pair (i, j) where 0 <= i < j < nums.length and low <= (nums[i] XOR nums[j]) <= high. ","Array,Bit Manipulation,Trie","VG9waWNUYWdOb2RlOjU=,VG9waWNUYWdOb2RlOjE5,VG9waWNUYWdOb2RlOjI3",Hard,46.3,9859,4565,,277,11,"Let's note that we can count all pairs with XOR ≤ K, so the answer would be to subtract the number of pairs withs XOR < low from the number of pairs with XOR ≤ high. For each value, find out the number of values when you XOR it with the result is  ≤ K using a trie.",,
Implement Trie II (Prefix Tree),implement-trie-ii-prefix-tree,1949,,"Hash Table,String,Design,Trie","VG9waWNUYWdOb2RlOjY=,VG9waWNUYWdOb2RlOjEw,VG9waWNUYWdOb2RlOjI1,VG9waWNUYWdOb2RlOjI3",Medium,59.3,12312,7297,,154,9,"Try to solve the first version first and reuse your code. To implement the delete function, you should delete the trie nodes of the word if they are not shared with other words. You should keep for each trie node a counter of how many words share this node.","208,1433","Implement Trie (Prefix Tree),Encrypt and Decrypt Strings"
Number of Different Integers in a String,number-of-different-integers-in-a-string,1933,"You are given a string word that consists of digits and lowercase English letters. You will replace every non-digit character with a space. For example, ""a123bc34d8ef34"" will become "" 123  34 8  34"". Notice that you are left with some integers that are separated by at least one space: ""123"", ""34"", ""8"", and ""34"". Return the number of different integers after performing the replacement operations on word. Two integers are considered different if their decimal representations without any leading zeros are different. ","Hash Table,String","VG9waWNUYWdOb2RlOjY=,VG9waWNUYWdOb2RlOjEw",Easy,35.6,71033,25298,,317,57,Try to split the string so that each integer is in a different string. Try to remove each integer's leading zeroes and compare the strings to find how many of them are unique.,,
Minimum Number of Operations to Reinitialize a Permutation,minimum-number-of-operations-to-reinitialize-a-permutation,1935,"You are given an even integer n​​​​​​. You initially have a permutation perm of size n​​ where perm[i] == i​ (0-indexed)​​​​. In one operation, you will create a new array arr, and for each i: You will then assign arr​​​​ to perm. Return the minimum non-zero number of operations you need to perform on perm to return the permutation to its initial value. ","Array,Math,Simulation","VG9waWNUYWdOb2RlOjU=,VG9waWNUYWdOb2RlOjg=,VG9waWNUYWdOb2RlOjYxMDU1",Medium,71.0,18282,12975,,199,114,It is safe to assume the number of  operations isn't more than n The number is small enough to apply a brute force solution.,,
Evaluate the Bracket Pairs of a String,evaluate-the-bracket-pairs-of-a-string,1934,"You are given a string s that contains some bracket pairs, with each pair containing a non-empty key. You know the values of a wide range of keys. This is represented by a 2D string array knowledge where each knowledge[i] = [keyi, valuei] indicates that key keyi has a value of valuei. You are tasked to evaluate all of the bracket pairs. When you evaluate a bracket pair that contains some key keyi, you will: Each key will appear at most once in your knowledge. There will not be any nested brackets in s. Return the resulting string after evaluating all of the bracket pairs. ","Array,Hash Table,String","VG9waWNUYWdOb2RlOjU=,VG9waWNUYWdOb2RlOjY=,VG9waWNUYWdOb2RlOjEw",Medium,66.7,28104,18758,,295,27,Process pairs from right to left to handle repeats Keep track of the current enclosed string using another string,,
Maximize Number of Nice Divisors,maximize-number-of-nice-divisors,1936,"You are given a positive integer primeFactors. You are asked to construct a positive integer n that satisfies the following conditions: Return the number of nice divisors of n. Since that number can be too large, return it modulo 109 + 7. Note that a prime number is a natural number greater than 1 that is not a product of two smaller natural numbers. The prime factors of a number n is a list of prime numbers such that their product equals n. ","Math,Recursion","VG9waWNUYWdOb2RlOjg=,VG9waWNUYWdOb2RlOjMx",Hard,30.4,15189,4610,,142,136,"The number of nice divisors is equal to the product of the count of each prime factor. Then the problem is reduced to: given n, find a sequence of numbers whose sum equals n and whose product is maximized. This sequence can have no numbers that are larger than 4. Proof: if it contains a number x that is larger than 4, then you can replace x with floor(x/2) and ceil(x/2), and floor(x/2) * ceil(x/2) > x. You can also replace 4s with two 2s. Hence, there will always be optimal solutions with only 2s and 3s. If there are three 2s, you can replace them with two 3s to get a better product. Hence, you'll never have more than two 2s. Keep adding 3s as long as n ≥ 5.",343,Integer Break
Ad-Free Sessions,ad-free-sessions,1958,,Database,VG9waWNUYWdOb2RlOjYxMDQz,Easy,59.9,14408,8634,,49,29,,,
Minimum Path Cost in a Hidden Grid,minimum-path-cost-in-a-hidden-grid,1959,,"Depth-First Search,Breadth-First Search,Graph,Heap (Priority Queue),Interactive","VG9waWNUYWdOb2RlOjIx,VG9waWNUYWdOb2RlOjIy,VG9waWNUYWdOb2RlOjI0,VG9waWNUYWdOb2RlOjYxMDUw,VG9waWNUYWdOb2RlOjYxMDU5",Medium,53.6,3337,1789,,51,17,"The grid is at a maximum 100 x 100, so it is clever to assume that the robot's initial cell is grid[101][101] Run a DFS from the robot's position to make sure that you can reach the target, otherwise you should return -1. Now that you are sure you can reach the target and that you know the grid, run Dijkstra to find the minimum cost.","865,1931","Robot Room Cleaner,Shortest Path in a Hidden Grid"
Find Interview Candidates,find-interview-candidates,1964,,Database,VG9waWNUYWdOb2RlOjYxMDQz,Medium,65.1,12296,8008,,110,17,,,
Determine Color of a Chessboard Square,determine-color-of-a-chessboard-square,1920,"You are given coordinates, a string that represents the coordinates of a square of the chessboard. Below is a chessboard for your reference.  Return true if the square is white, and false if the square is black. The coordinate will always represent a valid chessboard square. The coordinate will always have the letter first, and the number second. ","Math,String","VG9waWNUYWdOb2RlOjg=,VG9waWNUYWdOb2RlOjEw",Easy,77.7,45757,35535,,403,13,"Convert the coordinates to (x, y) - that is, ""a1"" is (1, 1), ""d7"" is (4, 7). Try add the numbers together and look for a pattern.",,
Sentence Similarity III,sentence-similarity-iii,1923,"A sentence is a list of words that are separated by a single space with no leading or trailing spaces. For example, ""Hello World"", ""HELLO"", ""hello world hello world"" are all sentences. Words consist of only uppercase and lowercase English letters. Two sentences sentence1 and sentence2 are similar if it is possible to insert an arbitrary sentence (possibly empty) inside one of these sentences such that the two sentences become equal. For example, sentence1 = ""Hello my name is Jane"" and sentence2 = ""Hello Jane"" can be made equal by inserting ""my name is"" between ""Hello"" and ""Jane"" in sentence2. Given two sentences sentence1 and sentence2, return true if sentence1 and sentence2 are similar. Otherwise, return false. ","Array,Two Pointers,String","VG9waWNUYWdOb2RlOjU=,VG9waWNUYWdOb2RlOjk=,VG9waWNUYWdOb2RlOjEw",Medium,32.4,29402,9519,,213,39,One way to look at it is to find one sentence as a concatenation of a prefix and suffix from the other sentence. Get the longest common prefix between them and the longest common suffix.,,
