Question Title,Question Slug,Question ID,Question Text,Topic Tagged text,Topic Tagged ID,Difficulty Level,Success Rate,total submission,total accepted,company tag,Likes,Dislikes,Hints,Similar Questions ID,Similar Questions Text
Flip Equivalent Binary Trees,flip-equivalent-binary-trees,988,"For a binary tree T, we can define a flip operation as follows: choose any node, and swap the left and right child subtrees. A binary tree X is flip equivalent to a binary tree Y if and only if we can make X equal to Y after some number of flip operations. Given the roots of two binary trees root1 and root2, return true if the two trees are flip equivalent or false otherwise. ","Tree,Depth-First Search,Binary Tree","VG9waWNUYWdOb2RlOjIw,VG9waWNUYWdOb2RlOjIx,VG9waWNUYWdOb2RlOjYxMDU3",Medium,66.7,161831,107916,,1594,70,,,
Largest Component Size by Common Factor,largest-component-size-by-common-factor,989,You are given an integer array of unique positive integers nums. Consider the following graph: Return the size of the largest connected component in the graph. ,"Array,Math,Union Find","VG9waWNUYWdOb2RlOjU=,VG9waWNUYWdOb2RlOjg=,VG9waWNUYWdOb2RlOjIz",Hard,40.2,108773,43757,,1235,86,,2276,Groups of Strings
Verifying an Alien Dictionary,verifying-an-alien-dictionary,990,"In an alien language, surprisingly, they also use English lowercase letters, but possibly in a different order. The order of the alphabet is some permutation of lowercase letters. Given a sequence of words written in the alien language, and the order of the alphabet, return true if and only if the given words are sorted lexicographically in this alien language. ","Array,Hash Table,String","VG9waWNUYWdOb2RlOjU=,VG9waWNUYWdOb2RlOjY=,VG9waWNUYWdOb2RlOjEw",Easy,52.5,655595,344275,,2739,916,,,
Array of Doubled Pairs,array-of-doubled-pairs,991,"Given an integer array of even length arr, return true if it is possible to reorder arr such that arr[2 * i + 1] = 2 * arr[2 * i] for every 0 <= i < len(arr) / 2, or false otherwise. ","Array,Hash Table,Greedy,Sorting","VG9waWNUYWdOb2RlOjU=,VG9waWNUYWdOb2RlOjY=,VG9waWNUYWdOb2RlOjE3,VG9waWNUYWdOb2RlOjYxMDQ5",Medium,38.7,181540,70184,,1075,127,,2117,Find Original Array From Doubled Array
Delete Columns to Make Sorted II,delete-columns-to-make-sorted-ii,992,"You are given an array of n strings strs, all of the same length. We may choose any deletion indices, and we delete all the characters in those indices for each string. For example, if we have strs = [""abcdef"",""uvwxyz""] and deletion indices {0, 2, 3}, then the final array after deletions is [""bef"", ""vyz""]. Suppose we chose a set of deletion indices answer such that after deletions, the final array has its elements in lexicographic order (i.e., strs[0] <= strs[1] <= strs[2] <= ... <= strs[n - 1]). Return the minimum possible value of answer.length. ","Array,String,Greedy","VG9waWNUYWdOb2RlOjU=,VG9waWNUYWdOb2RlOjEw,VG9waWNUYWdOb2RlOjE3",Medium,34.2,44573,15248,,443,69,,,
Tallest Billboard,tallest-billboard,993,"You are installing a billboard and want it to have the largest height. The billboard will have two steel supports, one on each side. Each steel support must be an equal height. You are given a collection of rods that can be welded together. For example, if you have rods of lengths 1, 2, and 3, you can weld them together to make a support of length 6. Return the largest possible height of your billboard installation. If you cannot support the billboard, return 0. ","Array,Dynamic Programming","VG9waWNUYWdOb2RlOjU=,VG9waWNUYWdOb2RlOjEz",Hard,39.9,32430,12945,,651,23,,2162,Partition Array Into Two Arrays to Minimize Sum Difference
Prison Cells After N Days,prison-cells-after-n-days,994,"There are 8 prison cells in a row and each cell is either occupied or vacant. Each day, whether the cell is occupied or vacant changes according to the following rules: Note that because the prison is a row, the first and the last cells in the row can't have two adjacent neighbors. You are given an integer array cells where cells[i] == 1 if the ith cell is occupied and cells[i] == 0 if the ith cell is vacant, and you are given an integer n. Return the state of the prison after n days (i.e., n such changes described above). ","Array,Hash Table,Math,Bit Manipulation","VG9waWNUYWdOb2RlOjU=,VG9waWNUYWdOb2RlOjY=,VG9waWNUYWdOb2RlOjg=,VG9waWNUYWdOb2RlOjE5",Medium,39.4,355942,140214,,1222,1513,,,
Check Completeness of a Binary Tree,check-completeness-of-a-binary-tree,998,"Given the root of a binary tree, determine if it is a complete binary tree. In a complete binary tree, every level, except possibly the last, is completely filled, and all nodes in the last level are as far left as possible. It can have between 1 and 2h nodes inclusive at the last level h. ","Tree,Breadth-First Search,Binary Tree","VG9waWNUYWdOb2RlOjIw,VG9waWNUYWdOb2RlOjIy,VG9waWNUYWdOb2RlOjYxMDU3",Medium,53.6,213148,114298,,1891,28,,,
Regions Cut By Slashes,regions-cut-by-slashes,999,"An n x n grid is composed of 1 x 1 squares where each 1 x 1 square consists of a '/', '\', or blank space ' '. These characters divide the square into contiguous regions. Given the grid grid represented as a string array, return the number of regions. Note that backslash characters are escaped, so a '\' is represented as '\\'. ","Depth-First Search,Breadth-First Search,Union Find,Graph","VG9waWNUYWdOb2RlOjIx,VG9waWNUYWdOb2RlOjIy,VG9waWNUYWdOb2RlOjIz,VG9waWNUYWdOb2RlOjI0",Medium,68.6,52702,36142,,2035,397,,,
Delete Columns to Make Sorted III,delete-columns-to-make-sorted-iii,1000,"You are given an array of n strings strs, all of the same length. We may choose any deletion indices, and we delete all the characters in those indices for each string. For example, if we have strs = [""abcdef"",""uvwxyz""] and deletion indices {0, 2, 3}, then the final array after deletions is [""bef"", ""vyz""]. Suppose we chose a set of deletion indices answer such that after deletions, the final array has every string (row) in lexicographic order. (i.e., (strs[0][0] <= strs[0][1] <= ... <= strs[0][strs[0].length - 1]), and (strs[1][0] <= strs[1][1] <= ... <= strs[1][strs[1].length - 1]), and so on). Return the minimum possible value of answer.length. ","Array,String,Dynamic Programming","VG9waWNUYWdOb2RlOjU=,VG9waWNUYWdOb2RlOjEw,VG9waWNUYWdOb2RlOjEz",Hard,56.5,18026,10191,,421,11,,,
N-Repeated Element in Size 2N Array,n-repeated-element-in-size-2n-array,1001,You are given an integer array nums with the following properties: Return the element that is repeated n times. ,"Array,Hash Table","VG9waWNUYWdOb2RlOjU=,VG9waWNUYWdOb2RlOjY=",Easy,75.4,232107,175078,,878,294,,,
Maximum Width Ramp,maximum-width-ramp,1002,"A ramp in an integer array nums is a pair (i, j) for which i < j and nums[i] <= nums[j]. The width of such a ramp is j - i. Given an integer array nums, return the maximum width of a ramp in nums. If there is no ramp in nums, return 0. ","Array,Stack,Monotonic Stack","VG9waWNUYWdOb2RlOjU=,VG9waWNUYWdOb2RlOjE1,VG9waWNUYWdOb2RlOjYxMDU0",Medium,48.2,68082,32790,,1125,35,,,
Minimum Area Rectangle II,minimum-area-rectangle-ii,1003,"You are given an array of points in the X-Y plane points where points[i] = [xi, yi]. Return the minimum area of any rectangle formed from these points, with sides not necessarily parallel to the X and Y axes. If there is not any such rectangle, return 0. Answers within 10-5 of the actual answer will be accepted. ","Array,Math,Geometry","VG9waWNUYWdOb2RlOjU=,VG9waWNUYWdOb2RlOjg=,VG9waWNUYWdOb2RlOjM4",Medium,54.4,41787,22753,,302,400,,,
Least Operators to Express Number,least-operators-to-express-number,1004,"Given a single positive integer x, we will write an expression of the form x (op1) x (op2) x (op3) x ... where each operator op1, op2, etc. is either addition, subtraction, multiplication, or division (+, -, *, or /). For example, with x = 3, we might write 3 * 3 / 3 + 3 - 3 which is a value of 3. When writing such an expression, we adhere to the following conventions: We would like to write an expression with the least number of operators such that the expression equals the given target. Return the least number of operators used. ","Math,Dynamic Programming","VG9waWNUYWdOb2RlOjg=,VG9waWNUYWdOb2RlOjEz",Hard,47.4,16755,7946,,256,65,,,
Univalued Binary Tree,univalued-binary-tree,1005,"A binary tree is uni-valued if every node in the tree has the same value. Given the root of a binary tree, return true if the given tree is uni-valued, or false otherwise. ","Tree,Depth-First Search,Breadth-First Search,Binary Tree","VG9waWNUYWdOb2RlOjIw,VG9waWNUYWdOb2RlOjIx,VG9waWNUYWdOb2RlOjIy,VG9waWNUYWdOb2RlOjYxMDU3",Easy,68.9,227655,156880,,1259,56,,1609,Find All The Lonely Nodes
Vowel Spellchecker,vowel-spellchecker,1006,"Given a wordlist, we want to implement a spellchecker that converts a query word into a correct word. For a given query word, the spell checker handles two categories of spelling mistakes: In addition, the spell checker operates under the following precedence rules: Given some queries, return a list of words answer, where answer[i] is the correct word for query = queries[i]. ","Array,Hash Table,String","VG9waWNUYWdOb2RlOjU=,VG9waWNUYWdOb2RlOjY=,VG9waWNUYWdOb2RlOjEw",Medium,51.6,68595,35410,,343,714,,,
Numbers With Same Consecutive Differences,numbers-with-same-consecutive-differences,1007,"Return all non-negative integers of length n such that the absolute difference between every two consecutive digits is k. Note that every number in the answer must not have leading zeros. For example, 01 has one leading zero and is invalid. You may return the answer in any order. ","Backtracking,Breadth-First Search","VG9waWNUYWdOb2RlOjE0,VG9waWNUYWdOb2RlOjIy",Medium,47.2,105324,49756,,860,131,,,
Binary Tree Cameras,binary-tree-cameras,1008,"You are given the root of a binary tree. We install cameras on the tree nodes where each camera at a node can monitor its parent, itself, and its immediate children. Return the minimum number of cameras needed to monitor all nodes of the tree. ","Dynamic Programming,Tree,Depth-First Search,Binary Tree","VG9waWNUYWdOb2RlOjEz,VG9waWNUYWdOb2RlOjIw,VG9waWNUYWdOb2RlOjIx,VG9waWNUYWdOb2RlOjYxMDU3",Hard,41.8,151382,63331,,2594,33,,1021,Distribute Coins in Binary Tree
Pancake Sorting,pancake-sorting,1009,"Given an array of integers arr, sort the array by performing a series of pancake flips. In one pancake flip we do the following steps: For example, if arr = [3,2,1,4] and we performed a pancake flip choosing k = 3, we reverse the sub-array [3,2,1], so arr = [1,2,3,4] after the pancake flip at k = 3. Return an array of the k-values corresponding to a sequence of pancake flips that sort arr. Any valid answer that sorts the array within 10 * arr.length flips will be judged as correct. ","Array,Two Pointers,Greedy,Sorting","VG9waWNUYWdOb2RlOjU=,VG9waWNUYWdOb2RlOjk=,VG9waWNUYWdOb2RlOjE3,VG9waWNUYWdOb2RlOjYxMDQ5",Medium,69.7,104899,73101,,1065,1226,,,
Powerful Integers,powerful-integers,1010,"Given three integers x, y, and bound, return a list of all the powerful integers that have a value less than or equal to bound. An integer is powerful if it can be represented as xi + yj for some integers i >= 0 and j >= 0. You may return the answer in any order. In your answer, each value should occur at most once. ","Hash Table,Math","VG9waWNUYWdOb2RlOjY=,VG9waWNUYWdOb2RlOjg=",Medium,43.6,105922,46133,,242,62,,,
Flip Binary Tree To Match Preorder Traversal,flip-binary-tree-to-match-preorder-traversal,1011,"You are given the root of a binary tree with n nodes, where each node is uniquely assigned a value from 1 to n. You are also given a sequence of n values voyage, which is the desired pre-order traversal of the binary tree. Any node in the binary tree can be flipped by swapping its left and right subtrees. For example, flipping node 1 will have the following effect: Flip the smallest number of nodes so that the pre-order traversal of the tree matches voyage. Return a list of the values of all flipped nodes. You may return the answer in any order. If it is impossible to flip the nodes in the tree to make the pre-order traversal match voyage, return the list [-1]. ","Tree,Depth-First Search,Binary Tree","VG9waWNUYWdOb2RlOjIw,VG9waWNUYWdOb2RlOjIx,VG9waWNUYWdOb2RlOjYxMDU3",Medium,49.9,69777,34793,,705,239,,,
Equal Rational Numbers,equal-rational-numbers,1012,"Given two strings s and t, each of which represents a non-negative rational number, return true if and only if they represent the same number. The strings may use parentheses to denote the repeating part of the rational number. A rational number can be represented using up to three parts: <IntegerPart>, <NonRepeatingPart>, and a <RepeatingPart>. The number will be represented in one of the following three ways: The repeating portion of a decimal expansion is conventionally denoted within a pair of round brackets. For example: ","Math,String","VG9waWNUYWdOb2RlOjg=,VG9waWNUYWdOb2RlOjEw",Hard,42.5,12568,5339,,67,184,,,
K Closest Points to Origin,k-closest-points-to-origin,1014,"Given an array of points where points[i] = [xi, yi] represents a point on the X-Y plane and an integer k, return the k closest points to the origin (0, 0). The distance between two points on the X-Y plane is the Euclidean distance (i.e., √(x1 - x2)2 + (y1 - y2)2). You may return the answer in any order. The answer is guaranteed to be unique (except for the order that it is in). ","Array,Math,Divide and Conquer,Geometry,Sorting,Heap (Priority Queue),Quickselect","VG9waWNUYWdOb2RlOjU=,VG9waWNUYWdOb2RlOjg=,VG9waWNUYWdOb2RlOjEy,VG9waWNUYWdOb2RlOjM4,VG9waWNUYWdOb2RlOjYxMDQ5,VG9waWNUYWdOb2RlOjYxMDUw,VG9waWNUYWdOb2RlOjYxMDY5",Medium,66.0,1115681,736146,,5350,205,,"215,347,692,1888","Kth Largest Element in an Array,Top K Frequent Elements,Top K Frequent Words,Find Nearest Point That Has the Same X or Y Coordinate"
Subarray Sums Divisible by K,subarray-sums-divisible-by-k,1016,"Given an integer array nums and an integer k, return the number of non-empty subarrays that have a sum divisible by k. A subarray is a contiguous part of an array. ","Array,Hash Table,Prefix Sum","VG9waWNUYWdOb2RlOjU=,VG9waWNUYWdOb2RlOjY=,VG9waWNUYWdOb2RlOjYxMDY4",Medium,53.2,174162,92620,,2709,133,,"560,1694","Subarray Sum Equals K,Make Sum Divisible by P"
Odd Even Jump,odd-even-jump,1017,"You are given an integer array arr. From some starting index, you can make a series of jumps. The (1st, 3rd, 5th, ...) jumps in the series are called odd-numbered jumps, and the (2nd, 4th, 6th, ...) jumps in the series are called even-numbered jumps. Note that the jumps are numbered, not the indices. You may jump forward from index i to index j (with i < j) in the following way: A starting index is good if, starting from that index, you can reach the end of the array (index arr.length - 1) by jumping some number of times (possibly 0 or more than once). Return the number of good starting indices. ","Array,Dynamic Programming,Stack,Monotonic Stack,Ordered Set","VG9waWNUYWdOb2RlOjU=,VG9waWNUYWdOb2RlOjEz,VG9waWNUYWdOb2RlOjE1,VG9waWNUYWdOb2RlOjYxMDU0,VG9waWNUYWdOb2RlOjYxMDcw",Hard,38.9,147425,57344,,1318,371,,,
Largest Perimeter Triangle,largest-perimeter-triangle,1018,"Given an integer array nums, return the largest perimeter of a triangle with a non-zero area, formed from three of these lengths. If it is impossible to form any triangle of a non-zero area, return 0. ","Array,Math,Greedy,Sorting","VG9waWNUYWdOb2RlOjU=,VG9waWNUYWdOb2RlOjg=,VG9waWNUYWdOb2RlOjE3,VG9waWNUYWdOb2RlOjYxMDQ5",Easy,56.0,137802,77188,,1065,119,,830,Largest Triangle Area
Squares of a Sorted Array,squares-of-a-sorted-array,1019,"Given an integer array nums sorted in non-decreasing order, return an array of the squares of each number sorted in non-decreasing order. ","Array,Two Pointers,Sorting","VG9waWNUYWdOb2RlOjU=,VG9waWNUYWdOb2RlOjk=,VG9waWNUYWdOb2RlOjYxMDQ5",Easy,71.6,1324165,948265,,5114,150,,"88,360","Merge Sorted Array,Sort Transformed Array"
Longest Turbulent Subarray,longest-turbulent-subarray,1020,"Given an integer array arr, return the length of a maximum size turbulent subarray of arr. A subarray is turbulent if the comparison sign flips between each adjacent pair of elements in the subarray. More formally, a subarray [arr[i], arr[i + 1], ..., arr[j]] of arr is said to be turbulent if and only if: ","Array,Dynamic Programming,Sliding Window","VG9waWNUYWdOb2RlOjU=,VG9waWNUYWdOb2RlOjEz,VG9waWNUYWdOb2RlOjU1ODIx",Medium,47.5,149840,71194,,1264,166,,53,Maximum Subarray
Distribute Coins in Binary Tree,distribute-coins-in-binary-tree,1021,"You are given the root of a binary tree with n nodes where each node in the tree has node.val coins. There are n coins in total throughout the whole tree. In one move, we may choose two adjacent nodes and move one coin from one node to another. A move may be from parent to child, or from child to parent. Return the minimum number of moves required to make every node have exactly one coin. ","Tree,Depth-First Search,Binary Tree","VG9waWNUYWdOb2RlOjIw,VG9waWNUYWdOb2RlOjIx,VG9waWNUYWdOb2RlOjYxMDU3",Medium,71.5,116380,83207,,3561,119,,"863,1008","Sum of Distances in Tree,Binary Tree Cameras"
Unique Paths III,unique-paths-iii,1022,"You are given an m x n integer array grid where grid[i][j] could be: Return the number of 4-directional walks from the starting square to the ending square, that walk over every non-obstacle square exactly once. ","Array,Backtracking,Bit Manipulation,Matrix","VG9waWNUYWdOb2RlOjU=,VG9waWNUYWdOb2RlOjE0,VG9waWNUYWdOb2RlOjE5,VG9waWNUYWdOb2RlOjYxMDUz",Hard,79.4,142480,113130,,2750,132,,"37,63,212","Sudoku Solver,Unique Paths II,Word Search II"
Time Based Key-Value Store,time-based-key-value-store,1023,Design a time-based key-value data structure that can store multiple values for the same key at different time stamps and retrieve the key's value at a certain timestamp. Implement the TimeMap class: ,"Hash Table,String,Binary Search,Design","VG9waWNUYWdOb2RlOjY=,VG9waWNUYWdOb2RlOjEw,VG9waWNUYWdOb2RlOjEx,VG9waWNUYWdOb2RlOjI1",Medium,52.8,331082,174658,,2024,207,,2161,Stock Price Fluctuation 
Triples with Bitwise AND Equal To Zero,triples-with-bitwise-and-equal-to-zero,1024,"Given an integer array nums, return the number of AND triples. An AND triple is a triple of indices (i, j, k) such that: ","Array,Hash Table,Bit Manipulation","VG9waWNUYWdOb2RlOjU=,VG9waWNUYWdOb2RlOjY=,VG9waWNUYWdOb2RlOjE5",Hard,57.5,21159,12167,,239,181,,,
Minimum Cost For Tickets,minimum-cost-for-tickets,1025,You have planned some train traveling one year in advance. The days of the year in which you will travel are given as an integer array days. Each day is an integer from 1 to 365. Train tickets are sold in three different ways: The passes allow that many days of consecutive travel. Return the minimum number of dollars you need to travel every day in the given list of days. ,"Array,Dynamic Programming","VG9waWNUYWdOb2RlOjU=,VG9waWNUYWdOb2RlOjEz",Medium,64.0,235327,150705,,4363,72,,322,Coin Change
String Without AAA or BBB,string-without-aaa-or-bbb,1026,"Given two integers a and b, return any string s such that: ","String,Greedy","VG9waWNUYWdOb2RlOjEw,VG9waWNUYWdOb2RlOjE3",Medium,42.2,78678,33185,,486,330,,,
Sum of Even Numbers After Queries,sum-of-even-numbers-after-queries,1027,"You are given an integer array nums and an array queries where queries[i] = [vali, indexi]. For each query i, first, apply nums[indexi] = nums[indexi] + vali, then print the sum of the even values of nums. Return an integer array answer where answer[i] is the answer to the ith query. ","Array,Simulation","VG9waWNUYWdOb2RlOjU=,VG9waWNUYWdOb2RlOjYxMDU1",Medium,60.9,102714,62602,,668,212,,,
Interval List Intersections,interval-list-intersections,1028,"You are given two lists of closed intervals, firstList and secondList, where firstList[i] = [starti, endi] and secondList[j] = [startj, endj]. Each list of intervals is pairwise disjoint and in sorted order. Return the intersection of these two interval lists. A closed interval [a, b] (with a <= b) denotes the set of real numbers x with a <= x <= b. The intersection of two closed intervals is a set of real numbers that are either empty or represented as a closed interval. For example, the intersection of [1, 3] and [2, 4] is [2, 3]. ","Array,Two Pointers","VG9waWNUYWdOb2RlOjU=,VG9waWNUYWdOb2RlOjk=",Medium,71.1,413025,293594,,4101,84,,"56,88,761","Merge Intervals,Merge Sorted Array,Employee Free Time"
Vertical Order Traversal of a Binary Tree,vertical-order-traversal-of-a-binary-tree,1029,"Given the root of a binary tree, calculate the vertical order traversal of the binary tree. For each node at position (row, col), its left and right children will be at positions (row + 1, col - 1) and (row + 1, col + 1) respectively. The root of the tree is at (0, 0). The vertical order traversal of a binary tree is a list of top-to-bottom orderings for each column index starting from the leftmost column and ending on the rightmost column. There may be multiple nodes in the same row and same column. In such a case, sort these nodes by their values. Return the vertical order traversal of the binary tree. ","Hash Table,Tree,Depth-First Search,Breadth-First Search,Binary Tree","VG9waWNUYWdOb2RlOjY=,VG9waWNUYWdOb2RlOjIw,VG9waWNUYWdOb2RlOjIx,VG9waWNUYWdOb2RlOjIy,VG9waWNUYWdOb2RlOjYxMDU3",Hard,41.4,520150,215521,,3104,3293,,,
Smallest String Starting From Leaf,smallest-string-starting-from-leaf,1030,"You are given the root of a binary tree where each node has a value in the range [0, 25] representing the letters 'a' to 'z'. Return the lexicographically smallest string that starts at a leaf of this tree and ends at the root. As a reminder, any shorter prefix of a string is lexicographically smaller. A leaf of a node is a node that has no children. ","String,Tree,Depth-First Search,Binary Tree","VG9waWNUYWdOb2RlOjEw,VG9waWNUYWdOb2RlOjIw,VG9waWNUYWdOb2RlOjIx,VG9waWNUYWdOb2RlOjYxMDU3",Medium,48.6,107393,52244,,1046,168,,"129,257","Sum Root to Leaf Numbers,Binary Tree Paths"
Add to Array-Form of Integer,add-to-array-form-of-integer,1031,"The array-form of an integer num is an array representing its digits in left to right order. Given num, the array-form of an integer, and an integer k, return the array-form of the integer num + k. ","Array,Math","VG9waWNUYWdOb2RlOjU=,VG9waWNUYWdOb2RlOjg=",Easy,45.4,236136,107305,,1195,144,,"2,66,67,415","Add Two Numbers,Plus One,Add Binary,Add Strings"
Satisfiability of Equality Equations,satisfiability-of-equality-equations,1032,"You are given an array of strings equations that represent relationships between variables where each string equations[i] is of length 4 and takes one of two different forms: ""xi==yi"" or ""xi!=yi"".Here, xi and yi are lowercase letters (not necessarily different) that represent one-letter variable names. Return true if it is possible to assign integers to variable names so as to satisfy all the given equations, or false otherwise. ","Array,String,Union Find,Graph","VG9waWNUYWdOb2RlOjU=,VG9waWNUYWdOb2RlOjEw,VG9waWNUYWdOb2RlOjIz,VG9waWNUYWdOb2RlOjI0",Medium,49.9,97712,48792,,1489,16,,,
Broken Calculator,broken-calculator,1033,"There is a broken calculator that has the integer startValue on its display initially. In one operation, you can: Given two integers startValue and target, return the minimum number of operations needed to display target on the calculator. ","Math,Greedy","VG9waWNUYWdOb2RlOjg=,VG9waWNUYWdOb2RlOjE3",Medium,54.2,157662,85399,,2254,184,,650,2 Keys Keyboard
Subarrays with K Different Integers,subarrays-with-k-different-integers,1034,"Given an integer array nums and an integer k, return the number of good subarrays of nums. A good array is an array where the number of different integers in that array is exactly k. A subarray is a contiguous part of an array. ","Array,Hash Table,Sliding Window,Counting","VG9waWNUYWdOb2RlOjU=,VG9waWNUYWdOb2RlOjY=,VG9waWNUYWdOb2RlOjU1ODIx,VG9waWNUYWdOb2RlOjYxMDYy",Hard,53.3,126886,67665,,2888,40,,"3,159,340,2186,2247","Longest Substring Without Repeating Characters,Longest Substring with At Most Two Distinct Characters,Longest Substring with At Most K Distinct Characters,Count Vowel Substrings of a String,Number of Unique Flavors After Sharing K Candies"
Cousins in Binary Tree,cousins-in-binary-tree,1035,"Given the root of a binary tree with unique values and the values of two different nodes of the tree x and y, return true if the nodes corresponding to the values x and y in the tree are cousins, or false otherwise. Two nodes of a binary tree are cousins if they have the same depth with different parents. Note that in a binary tree, the root node is at the depth 0, and children of each depth k node are at the depth k + 1. ","Tree,Depth-First Search,Breadth-First Search,Binary Tree","VG9waWNUYWdOb2RlOjIw,VG9waWNUYWdOb2RlOjIx,VG9waWNUYWdOb2RlOjIy,VG9waWNUYWdOb2RlOjYxMDU3",Easy,53.8,380002,204495,,2682,138,,102,Binary Tree Level Order Traversal
Rotting Oranges,rotting-oranges,1036,"You are given an m x n grid where each cell can have one of three values: Every minute, any fresh orange that is 4-directionally adjacent to a rotten orange becomes rotten. Return the minimum number of minutes that must elapse until no cell has a fresh orange. If this is impossible, return -1. ","Array,Breadth-First Search,Matrix","VG9waWNUYWdOb2RlOjU=,VG9waWNUYWdOb2RlOjIy,VG9waWNUYWdOb2RlOjYxMDUz",Medium,51.7,714974,369469,,6363,272,,"286,2206","Walls and Gates,Detonate the Maximum Bombs"
