Question Title,Question Slug,Question ID,Question Text,Topic Tagged text,Topic Tagged ID,Difficulty Level,Success Rate,total submission,total accepted,company tag,Likes,Dislikes,Hints,Similar Questions ID,Similar Questions Text
Maximum Sum of Two Non-Overlapping Subarrays,maximum-sum-of-two-non-overlapping-subarrays,1096,"Given an integer array nums and two integers firstLen and secondLen, return the maximum sum of elements in two non-overlapping subarrays with lengths firstLen and secondLen. The array with length firstLen could occur before or after the array with length secondLen, but they have to be non-overlapping. A subarray is a contiguous part of an array. ","Array,Dynamic Programming,Sliding Window","VG9waWNUYWdOb2RlOjU=,VG9waWNUYWdOb2RlOjEz,VG9waWNUYWdOb2RlOjU1ODIx",Medium,59.4,82510,49020,,1660,70,"We can use prefix sums to calculate any subarray sum quickly.
For each L length subarray, find the best possible M length subarray that occurs before and after it.",,
Stream of Characters,stream-of-characters,1097,"Design an algorithm that accepts a stream of characters and checks if a suffix of these characters is a string of a given array of strings words. For example, if words = [""abc"", ""xyz""] and the stream added the four characters (one by one) 'a', 'x', 'y', and 'z', your algorithm should detect that the suffix ""xyz"" of the characters ""axyz"" matches ""xyz"" from words. Implement the StreamChecker class: ","Array,String,Design,Trie,Data Stream","VG9waWNUYWdOb2RlOjU=,VG9waWNUYWdOb2RlOjEw,VG9waWNUYWdOb2RlOjI1,VG9waWNUYWdOb2RlOjI3,VG9waWNUYWdOb2RlOjYxMDYz",Hard,51.3,143999,73934,,1500,169,"Put the words into a trie, and manage a set of pointers within that trie.",,
Moving Stones Until Consecutive,moving-stones-until-consecutive,1103,"There are three stones in different positions on the X-axis. You are given three integers a, b, and c, the positions of the stones. In one move, you pick up a stone at an endpoint (i.e., either the lowest or highest position stone), and move it to an unoccupied position between those endpoints. Formally, let's say the stones are currently at positions x, y, and z with x < y < z. You pick up the stone at either position x or position z, and move that stone to an integer position k, with x < k < z and k != y. The game ends when you cannot make any more moves (i.e., the stones are in three consecutive positions). Return an integer array answer of length 2 where: ","Math,Brainteaser","VG9waWNUYWdOb2RlOjg=,VG9waWNUYWdOb2RlOjMy",Medium,45.0,43359,19493,,148,584,"For the minimum:  We can always do it in at most 2 moves, by moving one stone next to another, then the third stone next to the other two.  When can we do it in 1 move?  0 moves?

For the maximum:  Every move, the maximum position minus the minimum position must decrease by at least 1.",,
Coloring A Border,coloring-a-border,1104,"You are given an m x n integer matrix grid, and three integers row, col, and color. Each value in the grid represents the color of the grid square at that location. Two squares belong to the same connected component if they have the same color and are next to each other in any of the 4 directions. The border of a connected component is all the squares in the connected component that are either 4-directionally adjacent to a square not in the component, or on the boundary of the grid (the first or last row or column). You should color the border of the connected component that contains the square grid[row][col] with color. Return the final grid. ","Array,Depth-First Search,Breadth-First Search,Matrix","VG9waWNUYWdOb2RlOjU=,VG9waWNUYWdOb2RlOjIx,VG9waWNUYWdOb2RlOjIy,VG9waWNUYWdOb2RlOjYxMDUz",Medium,48.4,45975,22235,,400,597,"Use a DFS to find every square in the component.  Then for each square, color it if it has a neighbor that is outside the grid or a different color.",463,Island Perimeter
Uncrossed Lines,uncrossed-lines,1105,"You are given two integer arrays nums1 and nums2. We write the integers of nums1 and nums2 (in the order they are given) on two separate horizontal lines. We may draw connecting lines: a straight line connecting two numbers nums1[i] and nums2[j] such that: Note that a connecting line cannot intersect even at the endpoints (i.e., each number can only belong to one connecting line). Return the maximum number of connecting lines we can draw in this way. ","Array,Dynamic Programming","VG9waWNUYWdOb2RlOjU=,VG9waWNUYWdOb2RlOjEz",Medium,57.9,115444,66844,,1626,27,"Think dynamic programming.  Given an oracle dp(i,j) that tells us how many lines A[i:], B[j:]  [the sequence A[i], A[i+1], ... and B[j], B[j+1], ...] are uncrossed, can we write this as a recursion?",72,Edit Distance
Escape a Large Maze,escape-a-large-maze,1106,"There is a 1 million by 1 million grid on an XY-plane, and the coordinates of each grid square are (x, y). We start at the source = [sx, sy] square and want to reach the target = [tx, ty] square. There is also an array of blocked squares, where each blocked[i] = [xi, yi] represents a blocked square with coordinates (xi, yi). Each move, we can walk one square north, east, south, or west if the square is not in the array of blocked squares. We are also not allowed to walk outside of the grid. Return true if and only if it is possible to reach the target square from the source square through a sequence of valid moves. ","Array,Hash Table,Depth-First Search,Breadth-First Search","VG9waWNUYWdOb2RlOjU=,VG9waWNUYWdOb2RlOjY=,VG9waWNUYWdOb2RlOjIx,VG9waWNUYWdOb2RlOjIy",Hard,34.4,45503,15635,,449,139,"If we become stuck, there's either a loop around the source or around the target. If there is a loop around say, the source, what is the maximum number of squares it can have?",,
Valid Boomerang,valid-boomerang,1115,"Given an array points where points[i] = [xi, yi] represents a point on the X-Y plane, return true if these points are a boomerang. A boomerang is a set of three points that are all distinct and not in a straight line. ","Math,Geometry","VG9waWNUYWdOb2RlOjg=,VG9waWNUYWdOb2RlOjM4",Easy,37.4,82488,30881,,223,348,3 points form a boomerang if and only if the triangle formed from them has non-zero area.,,
Binary Search Tree to Greater Sum Tree,binary-search-tree-to-greater-sum-tree,1114,"Given the root of a Binary Search Tree (BST), convert it to a Greater Tree such that every key of the original BST is changed to the original key plus the sum of all keys greater than the original key in BST. As a reminder, a binary search tree is a tree that satisfies these constraints: ","Tree,Depth-First Search,Binary Search Tree,Binary Tree","VG9waWNUYWdOb2RlOjIw,VG9waWNUYWdOb2RlOjIx,VG9waWNUYWdOb2RlOjMw,VG9waWNUYWdOb2RlOjYxMDU3",Medium,84.7,139515,118113,,2499,133,What traversal method organizes all nodes in sorted order?,,
Minimum Score Triangulation of Polygon,minimum-score-triangulation-of-polygon,1111,"You have a convex n-sided polygon where each vertex has an integer value. You are given an integer array values where values[i] is the value of the ith vertex (i.e., clockwise order). You will triangulate the polygon into n - 2 triangles. For each triangle, the value of that triangle is the product of the values of its vertices, and the total score of the triangulation is the sum of these values over all n - 2 triangles in the triangulation. Return the smallest possible total score that you can achieve with some triangulation of the polygon. ","Array,Dynamic Programming","VG9waWNUYWdOb2RlOjU=,VG9waWNUYWdOb2RlOjEz",Medium,52.5,42068,22074,,991,113,"Without loss of generality, there is a triangle that uses adjacent vertices A[0] and A[N-1] (where N = A.length).  Depending on your choice K of it, this breaks down the triangulation into two subproblems A[1:K] and A[K+1:N-1].",,
Moving Stones Until Consecutive II,moving-stones-until-consecutive-ii,1113,"There are some stones in different positions on the X-axis. You are given an integer array stones, the positions of the stones. Call a stone an endpoint stone if it has the smallest or largest position. In one move, you pick up an endpoint stone and move it to an unoccupied position so that it is no longer an endpoint stone. The game ends when you cannot make any more moves (i.e., the stones are in three consecutive positions). Return an integer array answer of length 2 where: ","Array,Math,Two Pointers,Sorting","VG9waWNUYWdOb2RlOjU=,VG9waWNUYWdOb2RlOjg=,VG9waWNUYWdOb2RlOjk=,VG9waWNUYWdOb2RlOjYxMDQ5",Medium,55.5,13810,7670,,287,501,"For the minimum, how many cows are already in place?
For the maximum, we have to lose either the gap A[1] - A[0] or A[N-1] - A[N-2]  (where N = A.length), but every other space can be occupied.",2119,Minimum Number of Operations to Make Array Continuous
Robot Bounded In Circle,robot-bounded-in-circle,1119,"On an infinite plane, a robot initially stands at (0, 0) and faces north. Note that: The robot can receive one of three instructions: The robot performs the instructions given in order, and repeats them forever. Return true if and only if there exists a circle in the plane such that the robot never leaves the circle. ","Math,String,Simulation","VG9waWNUYWdOb2RlOjg=,VG9waWNUYWdOb2RlOjEw,VG9waWNUYWdOb2RlOjYxMDU1",Medium,55.4,328964,182345,,2914,610,"Calculate the final vector of how the robot travels after executing all instructions once - it consists of a change in position plus a change in direction. The robot stays in the circle if and only if (looking at the final vector) it changes direction (ie. doesn't stay pointing north), or it moves 0.",,
Flower Planting With No Adjacent,flower-planting-with-no-adjacent,1120,"You have n gardens, labeled from 1 to n, and an array paths where paths[i] = [xi, yi] describes a bidirectional path between garden xi to garden yi. In each garden, you want to plant one of 4 types of flowers. All gardens have at most 3 paths coming into or leaving it. Your task is to choose a flower type for each garden such that, for any two gardens connected by a path, they have different types of flowers. Return any such a choice as an array answer, where answer[i] is the type of flower planted in the (i+1)th garden. The flower types are denoted 1, 2, 3, or 4. It is guaranteed an answer exists. ","Depth-First Search,Breadth-First Search,Graph","VG9waWNUYWdOb2RlOjIx,VG9waWNUYWdOb2RlOjIy,VG9waWNUYWdOb2RlOjI0",Medium,49.8,109234,54424,,822,650,"Since each garden is connected to at most 3 gardens, there's always an available color for each garden.  For example, if one garden is next to gardens with colors 1, 3, 4,  then color #2 is available.",,
Partition Array for Maximum Sum,partition-array-for-maximum-sum,1121,"Given an integer array arr, partition the array into (contiguous) subarrays of length at most k. After partitioning, each subarray has their values changed to become the maximum value of that subarray. Return the largest sum of the given array after partitioning. Test cases are generated so that the answer fits in a 32-bit integer. ","Array,Dynamic Programming","VG9waWNUYWdOb2RlOjU=,VG9waWNUYWdOb2RlOjEz",Medium,70.3,67101,47141,,2083,196,"Think dynamic programming:  dp[i] will be the answer for array A[0], ..., A[i-1]. For j = 1 .. k that keeps everything in bounds, dp[i] is the maximum of dp[i-j] + max(A[i-1], ..., A[i-j]) * j .",2242,Subsequence of Size K With the Largest Even Sum
Longest Duplicate Substring,longest-duplicate-substring,1122,"Given a string s, consider all duplicated substrings: (contiguous) substrings of s that occur 2 or more times. The occurrences may overlap. Return any duplicated substring that has the longest possible length. If s does not have a duplicated substring, the answer is """". ","String,Binary Search,Sliding Window,Rolling Hash,Suffix Array,Hash Function","VG9waWNUYWdOb2RlOjEw,VG9waWNUYWdOb2RlOjEx,VG9waWNUYWdOb2RlOjU1ODIx,VG9waWNUYWdOb2RlOjU2NTk4,VG9waWNUYWdOb2RlOjU2Njk4,VG9waWNUYWdOb2RlOjYxMDY1",Hard,31.2,168568,52592,,1639,322,"Binary search for the length of the answer.  (If there's an answer of length 10, then there are answers of length 9, 8, 7, ...) To check whether an answer of length K exists, we can use Rabin-Karp 's algorithm.",,
Customers Who Bought All Products,customers-who-bought-all-products,1135,,Database,VG9waWNUYWdOb2RlOjYxMDQz,Medium,67.4,53096,35775,,175,35,,,
Last Stone Weight,last-stone-weight,1127,"You are given an array of integers stones where stones[i] is the weight of the ith stone. We are playing a game with the stones. On each turn, we choose the heaviest two stones and smash them together. Suppose the heaviest two stones have weights x and y with x <= y. The result of this smash is: At the end of the game, there is at most one stone left. Return the smallest possible weight of the left stone. If there are no stones left, return 0. ","Array,Heap (Priority Queue)","VG9waWNUYWdOb2RlOjU=,VG9waWNUYWdOb2RlOjYxMDUw",Easy,64.4,429868,276642,,3077,61,"Simulate the process.  We can do it with a heap, or by sorting some list of stones every time we take a turn.",,
Remove All Adjacent Duplicates In String,remove-all-adjacent-duplicates-in-string,1128,You are given a string s consisting of lowercase English letters. A duplicate removal consists of choosing two adjacent and equal letters and removing them. We repeatedly make duplicate removals on s until we no longer can. Return the final string after all such duplicate removals have been made. It can be proven that the answer is unique. ,"String,Stack","VG9waWNUYWdOb2RlOjEw,VG9waWNUYWdOb2RlOjE1",Easy,71.0,390692,277370,,3093,152,Use a stack to process everything greedily.,1320,Remove All Adjacent Duplicates in String II
Longest String Chain,longest-string-chain,1129,"You are given an array of words where each word consists of lowercase English letters. wordA is a predecessor of wordB if and only if we can insert exactly one letter anywhere in wordA without changing the order of the other characters to make it equal to wordB. A word chain is a sequence of words [word1, word2, ..., wordk] with k >= 1, where word1 is a predecessor of word2, word2 is a predecessor of word3, and so on. A single word is trivially a word chain with k == 1. Return the length of the longest possible word chain with words chosen from the given list of words. ","Array,Hash Table,Two Pointers,String,Dynamic Programming","VG9waWNUYWdOb2RlOjU=,VG9waWNUYWdOb2RlOjY=,VG9waWNUYWdOb2RlOjk=,VG9waWNUYWdOb2RlOjEw,VG9waWNUYWdOb2RlOjEz",Medium,57.8,338994,195915,,3279,161,"Instead of adding a character, try deleting a character to form a chain in reverse. For each word in order of length, for each word2 which is word with one character removed, length[word2] = max(length[word2], length[word] + 1).",,
Last Stone Weight II,last-stone-weight-ii,1130,"You are given an array of integers stones where stones[i] is the weight of the ith stone. We are playing a game with the stones. On each turn, we choose any two stones and smash them together. Suppose the stones have weights x and y with x <= y. The result of this smash is: At the end of the game, there is at most one stone left. Return the smallest possible weight of the left stone. If there are no stones left, return 0. ","Array,Dynamic Programming","VG9waWNUYWdOb2RlOjU=,VG9waWNUYWdOb2RlOjEz",Medium,51.0,102963,52471,,2080,74,"Think of the final answer as a sum of weights with + or - sign symbols infront of each weight.  Actually, all sums with 1 of each sign symbol are possible. Use dynamic programming: for every possible sum with N stones, those sums +x or -x is possible with N+1 stones, where x is the value of the newest stone.  (This overcounts sums that are all positive or all negative, but those don't matter.)",2162,Partition Array Into Two Arrays to Minimize Sum Difference
Actors and Directors Who Cooperated At Least Three Times,actors-and-directors-who-cooperated-at-least-three-times,1136,"Table: ActorDirector  Write a SQL query for a report that provides the pairs (actor_id, director_id) where the actor has cooperated with the director at least three times. Return the result table in any order. The query result format is in the following example. ",Database,VG9waWNUYWdOb2RlOjYxMDQz,Easy,72.5,60690,44002,,138,24,,,
