Question Title,Question Slug,Question ID,Question Text,Topic Tagged text,Topic Tagged ID,Difficulty Level,Success Rate,total submission,total accepted,company tag,Likes,Dislikes,Hints,Similar Questions ID,Similar Questions Text
Flatten Nested List Iterator,flatten-nested-list-iterator,341,"You are given a nested list of integers nestedList. Each element is either an integer or a list whose elements may also be integers or other lists. Implement an iterator to flatten it. Implement the NestedIterator class: Your code will be tested with the following pseudocode: If res matches the expected flattened list, then your code will be judged as correct. ","Stack,Tree,Depth-First Search,Design,Queue,Iterator","VG9waWNUYWdOb2RlOjE1,VG9waWNUYWdOb2RlOjIw,VG9waWNUYWdOb2RlOjIx,VG9waWNUYWdOb2RlOjI1,VG9waWNUYWdOb2RlOjM0,VG9waWNUYWdOb2RlOjYxMDY0",Medium,58.7,484448,284132,,3052,1068,,"251,281,385,565","Flatten 2D Vector,Zigzag Iterator,Mini Parser,Array Nesting"
Power of Four,power-of-four,342,"Given an integer n, return true if it is a power of four. Otherwise, return false. An integer n is a power of four, if there exists an integer x such that n == 4x. ","Math,Bit Manipulation,Recursion","VG9waWNUYWdOb2RlOjg=,VG9waWNUYWdOb2RlOjE5,VG9waWNUYWdOb2RlOjMx",Easy,43.9,663170,291168,,1445,285,,"231,326","Power of Two,Power of Three"
Integer Break,integer-break,343,"Given an integer n, break it into the sum of k positive integers, where k >= 2, and maximize the product of those integers. Return the maximum product you can get. ","Math,Dynamic Programming","VG9waWNUYWdOb2RlOjg=,VG9waWNUYWdOb2RlOjEz",Medium,54.0,337951,182547,,2696,324,There is a simple O(n) solution to this problem. You may check the breaking results of n ranging from 7 to 10 to discover the regularities.,1936,Maximize Number of Nice Divisors
Reverse String,reverse-string,344,Write a function that reverses a string. The input string is given as an array of characters s. You must do this by modifying the input array in-place with O(1) extra memory. ,"Two Pointers,String,Recursion","VG9waWNUYWdOb2RlOjk=,VG9waWNUYWdOb2RlOjEw,VG9waWNUYWdOb2RlOjMx",Easy,74.7,2078623,1553675,,4831,937,The entire logic for reversing a string is based on using the opposite directional two-pointer approach!,"345,541","Reverse Vowels of a String,Reverse String II"
Reverse Vowels of a String,reverse-vowels-of-a-string,345,"Given a string s, reverse only all the vowels in the string and return it. The vowels are 'a', 'e', 'i', 'o', and 'u', and they can appear in both cases. ","Two Pointers,String","VG9waWNUYWdOb2RlOjk=,VG9waWNUYWdOb2RlOjEw",Easy,46.9,737331,345831,,1560,1823,,"344,1089","Reverse String,Remove Vowels from a String"
Moving Average from Data Stream,moving-average-from-data-stream,346,,"Array,Design,Queue,Data Stream","VG9waWNUYWdOb2RlOjU=,VG9waWNUYWdOb2RlOjI1,VG9waWNUYWdOb2RlOjM0,VG9waWNUYWdOb2RlOjYxMDYz",Easy,76.3,332734,253722,,1255,118,,2211,K Radius Subarray Averages
Top K Frequent Elements,top-k-frequent-elements,347,"Given an integer array nums and an integer k, return the k most frequent elements. You may return the answer in any order. ","Array,Hash Table,Divide and Conquer,Sorting,Heap (Priority Queue),Bucket Sort,Counting,Quickselect","VG9waWNUYWdOb2RlOjU=,VG9waWNUYWdOb2RlOjY=,VG9waWNUYWdOb2RlOjEy,VG9waWNUYWdOb2RlOjYxMDQ5,VG9waWNUYWdOb2RlOjYxMDUw,VG9waWNUYWdOb2RlOjYxMDYw,VG9waWNUYWdOb2RlOjYxMDYy,VG9waWNUYWdOb2RlOjYxMDY5",Medium,65.1,1418616,923599,,8858,360,,"192,215,451,659,692,1014,1919","Word Frequency,Kth Largest Element in an Array,Sort Characters By Frequency,Split Array into Consecutive Subsequences,Top K Frequent Words,K Closest Points to Origin,Sort Features by Popularity"
Design Tic-Tac-Toe,design-tic-tac-toe,348,,"Array,Hash Table,Design,Matrix","VG9waWNUYWdOb2RlOjU=,VG9waWNUYWdOb2RlOjY=,VG9waWNUYWdOb2RlOjI1,VG9waWNUYWdOb2RlOjYxMDUz",Medium,57.2,313470,179359,,1626,94,"Could you trade extra space such that move() operation can be done in O(1)? You need two arrays: int rows[n], int cols[n], plus two variables: diagonal, anti_diagonal.",810,Valid Tic-Tac-Toe State
Intersection of Two Arrays,intersection-of-two-arrays,349,"Given two integer arrays nums1 and nums2, return an array of their intersection. Each element in the result must be unique and you may return the result in any order. ","Array,Hash Table,Two Pointers,Binary Search,Sorting","VG9waWNUYWdOb2RlOjU=,VG9waWNUYWdOb2RlOjY=,VG9waWNUYWdOb2RlOjk=,VG9waWNUYWdOb2RlOjEx,VG9waWNUYWdOb2RlOjYxMDQ5",Easy,68.9,939599,647468,,2731,1878,,"350,1149,1392,2190,2282","Intersection of Two Arrays II,Intersection of Three Sorted Arrays,Find the Difference of Two Arrays,Count Common Words With One Occurrence,Choose Numbers From Two Arrays in Range"
Intersection of Two Arrays II,intersection-of-two-arrays-ii,350,"Given two integer arrays nums1 and nums2, return an array of their intersection. Each element in the result must appear as many times as it shows in both arrays and you may return the result in any order. ","Array,Hash Table,Two Pointers,Binary Search,Sorting","VG9waWNUYWdOb2RlOjU=,VG9waWNUYWdOb2RlOjY=,VG9waWNUYWdOb2RlOjk=,VG9waWNUYWdOb2RlOjEx,VG9waWNUYWdOb2RlOjYxMDQ5",Easy,54.8,1412120,774103,,4292,684,,"349,1044,1392,2282","Intersection of Two Arrays,Find Common Characters,Find the Difference of Two Arrays,Choose Numbers From Two Arrays in Range"
